bar-b026e4f38a4f39bb686c9b3f5d4b4c3b	Des Madl hot des Fenster z'schlong.
bar-9da4533de5a6b4d3dc718b8deab9cdbc	'Das komische G'wandl vom Sami hod owei no o'g'halten.
bar-87dd418176089a2bfdfd1cfa78906bc8	Des Essen war ausgezeichnet in Italien.
bar-245b8d9e89c15aba05cb7732dae989d4	Da Tom hod Geld vaverschenka woin.
bar-9c28b5ea37cfda3ec5c9a6921e97a341	Nur i derf des macha!
bar-598692070a1634789678621a8bfb4249	Wos macht da Vollmond mit dir?
bar-ed8383d1980a4f5573665903d5d4fa24	I wer'sm Tom ned vazähln.
bar-c06a16e06b69074fa0827f1d1b7f493d	Da Hund vom Nachbarn is g'storbn.
bar-220ca0f1c0dbf5de576dbfad8ac3257b	Mach dem Tom a Getränk.
bar-17bafc9127bbb79dd99c59e28c93be3d	Was sogt ma dazua?
bar-3964bd88c83236b30e5f4e42d8a9f692	Mogst wos Lustigs hearn?
bar-9c2149492c40dbe004c05a873a7b74d9	Da Ventilator is hi.
bar-4f6926cbaf7cc89a5e5a38bc2f084758	I kriag des scho irgendwie hi.
bar-178f126428f3fc8423393e1bb0fca386	Da Tom is a bisserl z'spät kemma.
