bar-8d2be2d5a0b0d2911666030dbcd1b2e7	Er ko perfekt andere Sprochn wia Italienisch, Esperanto und Toki Pona.
bar-98823ec8092751f4f5b67b39c9d79ae3	Dös BH is ohne Bügel.
bar-be746c65c11a0afe5bc66c2c9b701498	Des is a Bügel-BH.
bar-b20c6d6d236a33c9e4ffef2aa96a9223	Dös BH hod Schuadaträger.
bar-3555f2265cc696f0357a7a8778b99d07	Dös BH hod koane Träger.
bar-c45fbd7c25768fa40a75f1c8f1938827	Da Außenminister war wia a Marionett.
bar-ac88c674dffef4e0f61b1a7b8f1c9a32	De Lehrer haltn unter am riesigen Druck den Unterricht aufrecht.
bar-a7f214e00c6316114b14d0b2683f3db6	Hast a a Schüssel für d' Suppn?
bar-80c9000c35d2d6c1db4f36a79fa1122c	Hast a a Suppnschissl?
bar-9465a59cd0c96cbc03e9440aef522233	D'Maria hod a Ei gnumma und hod's am Rand von da Schüssel aufgschlagn.
bar-e771bd2d6cd45208befdd102e1059f18	Schwemm de Teller ab!
bar-b4bdf693b78d7fd0ea14d94469b01576	Gib ma den Pfannenwender!
bar-b75b29fe5913268eae9e2f9c00839dc1	Wo is da Pfannawenda?
bar-9161fdc4d234ffa2021d673083fa117c	Weg mit dem Messer!
bar-36f95c4b26dbcdbd3796ef93c5f41203	Loss des Messer falln!
bar-5a1634d1aa758251baee36280641cbbe	I samml Silberschöpfa.
bar-5485adb4bed8ac9e8649404ceb10fced	Mia gemma a Hoibe zua.
bar-1d766601a2b011e2af970925faeb6bcc	I hob de Wassagläser auffüllt.
bar-2ad66c2dfa04365247f14407c3b1635e	Gib ma mei Teetassl!
bar-7f9884e4d041464df7e30b4f686f9d22	Gib ma mei Kaffeetass!
bar-cb083c37c61d209804b7cfe42a01f7a7	Pass auf, dass nix rausspritzt, wennst'n Rührer benutzt!
bar-fc27e278d6efff4c968bdf9223bbb322	Mogst de Eier mit'm Mixer aufschlagn?
bar-6b5feaff36541d153e2dcd8c7340b326	I nimm Waschpulver.
bar-8d28d31d0552769157a4f651ef1584b1	I nutz' Flüssigwaschmittel ned gern.
bar-a657204a6a4a96b304133ee606b1c3b2	Des is gmein!
bar-b2d9432036333ccd268f2a9ca64b1167	Loss mi doch a amoi g'winna!
bar-e2ead2c1c9b4bc5a9fadfcc775fde8ce	Du bist a rechter Gfrast!
bar-f8a20ec9b705296ba7a94715b009e619	I red Esperanto, seitdem i's vor langer Zeit g'lernt hab.
bar-418d0f292d463fc20c1f93067dece73c	Er woaß, wo d'Gaudi is.
bar-2f644a3ad1e38c185b5211b84a07ac37	De treuesten Saue werdn zerscht gschlachta.
bar-61cf5969709698db4e5e71c3ce522509	Erfolg basiert auf da Geduld vo de Andern.
bar-9cd621120fe52972468801cec6268bba	Es gibt aa, wos ned gsehn werd.
bar-4c10ca1904f10ab1dc4a448c78285375	Frohlich soi mei Herzal springa in dera Zeit, wo vor Freid alle Engerl singa.
bar-4626d71463cef69b05d421de003f7ac5	Manna ziang si unaufällig grau o, weil's in andern Sach'n umso bunter zuageht.
bar-19d38f0ca5c5b57af5734d9d7d9d98d2	A Lediger is a Mo, der an Haupttreffer macha will, indemma koans Los kauft.
bar-c9902205012f36217a0437b2d4c3bb53	Nix is im Lebn ernst z'nehma, weil nix es wirklich verdient.
bar-4afe8b6e0ec11b454ced1406ad59ab70	I wui leb'n, aa wenn i doud bin.
bar-f7805eb9d0f6ad7c1560bcec160339ee	D'Grundlag von unserm Dasein is d'Ernährung.
bar-1f52005d14e780b945895434aac31beb	I hob eam g'sogt, dass i'n aa gern hätt.
bar-1257b589aad55bfa9eb67373e67281ae	D' Maria hat auf'n Tom sei Tochter aufpasst, wie der im Gfängnis g'sessen is.
bar-d6a4f1f8f3c28eb2781c4a5b85bd4be0	Da Türsteher hod si g'weigert, dass da Tom und seine Spezln eini derfen.
bar-3789f4064a44a3a9f3e3bc1dbbca9872	Da Tom hod seina Freiheit wieda kriagt.
bar-8886a0f3cd0bc98fda023e7ad4ab6860	Des is des End vo da verheißna Freiheit.
bar-62345d552cd1be85769d72228e6181c0	I mog den Klang vo Toki Pona fei gern.
bar-ee4cd9771cb233ad6a3037627760f4cf	Warum host du dei Arbeit auf da Farm aufg'gebn?
bar-f3694f5ff7fc907d936bd473b54cd130	Es gibt ned vui Oabat.
bar-2398df07690345f4a94a27b09c866c87	Des Gmüad is wuid schee.
bar-ddca9d6adeb2d240fceb822c88b40edc	Mia miassn uns an de Fakten hoidn.
bar-e745ce3d9363adfeee11d421fd94acf2	I hob gestern vui gschafft.
bar-093a2d3bd131fb3bcd4d36f754e5f4aa	Da Tom hätt' fragen soll'n.
bar-069fe4b1c6518903d17122dad2045570	Wos i in da Stadt am meisten vermiss, is da nächtliche Sternenhimmel.
bar-395d1bec771770dae4bde3aace486101	I ko's gar ned gnua loben.
bar-7b6a6245c3df29f277375c33ee5d925f	I dad gern noch Gaborone.
bar-665227537ff75d363d9a838427b42623	I hob an Freind, der Tswana redt, und der hilft ma.
bar-25580228be1e37af56635baf78ffddc0	Er blås in d'Trompetn und hod an melodischn Ton ausbracht.
bar-51abe0149ecea717fd61e0fe5b0cd7e7	Mit ihre langa Schnäbel, wonach's a den Nam ham, grab'n de Langschnabelsittich' nach de Wurzeln vo de Gräser.
bar-0581af23132a366612298d67f99d9580	„Da Kalle und da Ede planen wos.“ – „De san doch beide grod erst aus'm Häfn kemma!“
bar-f5f259bd549b7c351b9cb57a73b190e4	Wia i zruckkemma bin, war koana mehr do.
bar-39ba3b3a37856b14ae11ac452abf8760	Nach Johr im Gfängnis is da Tom mit’m Leb’n in Freiheit nimma z’recht kemma.
bar-0e8fcbbc25ccf0b101c39030f51554df	Was isst'n du do?
bar-ef87204d0e4b61c5a3c601af9009682a	Des bestell i ma a.
bar-1eeadf5b12dcb40c12c44542026b962c	D'Reis findt ohne Begleitung statt.
bar-4194832927ca84181990343e2bd32c94	Mir fehlt der nötige Grips, dass i die Aufgab' lösen kann.
bar-f8948840412c413b22d0ecf30ae29c9c	I werd mi an d' Maria wenden.
bar-52e6b19011c58d58fa6360439542945c	Dem fällt scho wos ei.
bar-d461f39e664d5b4524819542261b93d3	Do muaß scho a weng Hirnschmalz ham, dass ma des Aufgaberl löst.
bar-ef4e8997c64b9e11e9b45bba32f170bb	An unserer Schui werd euer Kind herzlich betreut.
bar-c9315225196c06a8a104dc8f1309917a	„Wia lernst'n du Suaheli?“ – „I hob a Freindin, deas redt des, und de bringt's ma bei.“
bar-622bf030ac6ecdcdea61f436b880bdc2	Redst Suaheli?
bar-9182624d6ebef7d06fbc898736ff1685	Sakradi!
bar-1632011b4e142935f98c1ee775304903	I hob im neintn Stock g'wohnt.
bar-902c82253ca63804828a63519712ce4d	In zwoa Joa hoff i, dass i gscheid Spanisch redn ko.
bar-a11cdda31b1c247e9f6fafc90f3b283e	So dermaßen muskelbepackte Körperkulturisten schaun erschreckend aus.
bar-66e838019022a9a81115db28fcaaf51b	Ziag langsam d’Sockn aus und zoag dei Fiaß!
bar-9ac51831757ad3c63ebbdf6c97d875bb	Zu dem Gwand g'hörn aa Handschellen dazu.
bar-d72725620992bff2df5f02465d934b52	Da werd i ihr scho zoang, wo ihr Platz is!
bar-820452c4d32b4c86caaf635f02ebe7cd	I hob in da Taschn nix gfundn.
bar-cca35350280a11816dc69565782f4780	Koana is guad außer da Herrgott.
bar-b80062cc69ad969e2ce798c9c0ecafb9	Mei Wellensittich is vui.
bar-b07387381810e4864a95bf34299b94fc	I wui ned undankbar ausschaun.
bar-b47fdafce3aceaac2a6b9deb258100ff	Iatz pack i meine Eltern.
bar-e43bbd39b478911823a471dc67ef0c88	I mog'n ned seng.
bar-573526556271a971a6d645e0c77ea816	I mog's ned seng.
bar-4faf7bcb51ba743c36b8addfeb88f187	Mädla fian leise.
bar-f36f29a27ae2d2f46df53ec8fe645138	Könn ma'n Tom fragen?
bar-3632509738d51996ff730f478e69fa7f	Er hod ma gestern Obnd ois erzählt.
bar-7bfe823d4f86ece306860bdb8d3fc711	D'Frauen in da Nibelungensage san vui mehr emanzipiert, ois wia de Griechinnen des woarn.
bar-ef43e34a804e83578e12e5a06ca44fcc	Nehma ma d'Helena als Beispiel: de is überhaubt ned g'fragt wordn.
bar-725cb7ab98501b3c003f2d8ff1711068	Da Mächtigste hod's zur Frau kriagt.
bar-6a2e849194ef048b7a5f59b1b16e3484	D'Kriemhild war hingegen so stark im Charakter, wie ihre drei Brüada, da Gunther, da Gernot und da Giselher, schwach war'n, und sie war wählerisch.
bar-977924404d882a3f67712e161c9dcdf1	De Manna warn ihr net schee gnua, z'oid oder – wos meischtns da Fall war – net gscheid gnua.
bar-738e019472fbcd406a7cf07b5ff32277	Da Tom hod si d'Ziel gsetzt, endlich amoi an Schüla z'findn, der'n übertrifft – des wünscht si jeder guade Lehrer.
bar-e21bebdf4307c488428b37187dd29d3a	Und dann is Abend wordn, und dann is Nacht wordn, und da Tom hod si vawiad.
bar-c45ff5cb62ed52202f4437c8b59dd36f	Oana Tages hoaß's: „Krieg!“ Es is passiert, wos ma oiwei gfürcht hod.
bar-97b977da8334dc50337877ad111c7456	Da Tom hod mit seiner Angst alle andern o'gsteckt, vor allem d' Maria.
bar-506896e957a3f1e14ba54cfe868a7f0e	Du host g'hört, wos ma do g'redt ham.
bar-ab67a60b8a8dbba1364b06a5cde27cc9	Wos is dei Meining?
bar-a085af559aab3481084c981d78f3b560	Wirst uns hoid'n?
bar-f88c6ba01c1a078b96d4c13a6086cd33	Do hod da Tom gsagt: „Weil ma eh verliern, kinnan ma glei an Ogriff probiern, statt dass ma uns verteidign.“
bar-cdf7992078dc39feecce7539cf447d1b	Da Tom war naiv, oba er war trotzdem gscheid.
bar-e58a750bc2b101952e912a3f71a3c37b	Da Tom hod gwusst, es gibt nur oane Rettung fia eam, und de hoaßt Johannes.
bar-39fe7831ec9764604869259a13d72cd3	Mei Freind san mei Familie.
bar-69f5f483c90db5d4dd8fce1f36a4d304	„In da ersten Wöll in de 1930er und 1940er san de Superheldn hauptsoch Manna und fasst ausnahmslos Weiße gwen“, hod da Saunders gsagt.
bar-c86c6285f50fa7e6152e5068b3a8dd4a	„Hobts'n damals kennt?“ frog i. – „Ja, i hob'n guad kennt.“
bar-d7d362078d029de23cf1bdcced434f79	In der Tat war er früher amoi oana vo meine Freier gwen.
bar-0c5917a99973fe5a7afae217a09ac537	Tom und Maria ham a Giraff und ihr Kloan's gsehn.
bar-c17e22c5b66278b31bd22f6f744c1760	I möcht da a Geheimnis anvertraugn.
bar-69cd9d53af60a5679ebb508b87da570a	D' Maria hod'n Tom net in d'Aug'n g'schaut.
bar-8d4adfafdf04e3da009f5cb3202c1746	Mia telefonier'n regelmäßig, des bringt ma a bissl Trost.
bar-a0986080866f84161d2fba41cf6055a7	I hob scho drei Tassen Kaffee gsoffa.
bar-509a07cfbb7df255d74e0ec54af59f65	Mia ham vui Mistkübl auf da Welt, aba nur oane Natur.
bar-019be767ca8ef3c0c258321f9d56059a	A Fahrkart, oane Rückfahrt, noch Boston bittschön.
bar-d3035272854e14ae2d978c09ab240b9d	Da Tom hod si a bleds Papphütl aufgsetzt.
bar-f9e72cd6d212b629edf32e8f00a8d3bd	Da Tom hat si's Brot mit Butter bstrichn.
bar-f6bdddbfbc951c2740362c861137e555	Bin i fad?
bar-1efd35f867b2e0fc6b55bdeaefbadca3	Sie war fei zauberhaft schee.
bar-6a98b89fc1c4aa559631d89f1d0dcd45	I hob für jedes Problem a Lösung.
bar-5e166cad6d62aec86003c69037b78f8c	Allerdings macha meine Lösungen meistens drei neiche Probleme.
bar-120f80815756226e7f82584eb8671650	Reife werd oft mit Wissen verwechselt.
bar-75ca2111106e6c93e38b1041af3706f8	Kocha is a lebenswichtige Fähigkeit, de ma vagessn ham.
bar-d8afdf8159e1d4cf9621d1516f77c891	Da Tom redt sei Freindin o.
bar-ead6ef430a1a725cd1ed0d15dce9fc05	I mecht mei Sackerlgeld.
bar-86a528d5c059a09611950b92be7557d5	Loss ma's probiern.
bar-f3015c91d13bdbbc97eb1d6d169362e6	I bin frei!
bar-919e3f541bd3b42881f8667f8e3a46ba	Bist du irgendwo hi gfahrn?
bar-095bde2627ee7d1422240c83a3e07342	Nimm an Schirm mit.
bar-5fca7bc8ef746f9e742d013c1147f43d	Er hod's Hemd ausg'zoagn.
bar-d0f4e3871e76dee78d1ac2eace124987	I brauch Hife!
bar-3c1c3fa999301221063605821923a5b8	Otem.
bar-e07b8f80cbf5d085689af8fdea418cec	Des schaut lustig aus.
bar-cf8b3569a015d594f4918f08d6c01cd7	Entspann di.
bar-d8ccb55afce2248fde23374d1f562561	Du schaffst vui.
bar-a1b8cb11810bfe5d8d84bd3b5c582716	I hob mi verbrannt.
bar-2af64896b332bb8b82104d17845fdd08	I hob'n g'fangt.
bar-96512a99f227f83e9164fd3a067cef10	Stör i ned?
bar-a160d6580cb03c708dbb3e8388da65c7	Du warst eig'laden.
bar-1bf4b3a042ad08acd52414937cf531e7	Bluadtröpferl.
bar-113640fb6eb89e1972940e9ae3530f13	I üb' jed'n Dog.
bar-7918f17224a65727d929effe74685ede	Du schaust fesch aus.
bar-ccf6dd9fe41445fe4929bc2976314b63	I hob ned oafanga.
bar-6f46d8b200e28da723226e10ae781fc0	I hob an Huster g'hört.
bar-fb029695fa509059bcc6de70d2df84a2	I hob wen hustn g'hört.
bar-77198ebaa2da553fa3e68530f5ce4102	I hob Schrit g'hert.
bar-77198ebaa2da553fa3e68530f5ce4102	I hob Schrit g'hert.
bar-4f0cc383640888d55e9ac1b30ccd19d9	I mog Bier.
bar-c918fea0f712ebae1cb7b714ea716496	Mir ham a Waschmaschin kauft.
bar-1abf6ce7b3c1702d2eeac4583ee48efc	Du hust scho greislig.
bar-adc102feb5dc313df50f4681f6b3b54f	Da Stift is aufm Tisch.
bar-5b8f1274b23b637f43eaa239c8aa0b82	Loss ma ned geh.
bar-db283b70a17a6e4ae293f9df7da57913	Da Tom is scho recht tollpatschig, oder?
bar-3dc6e59a7a46b70b7eb96532ef00eea2	Des war gschert.
bar-b7b63f617632a61004b99ade3d9324c7	Soll i da erklärn, wia des funktioniert?
bar-df3a458f6b22610b20de5afc628f8129	Fährst mi zum Bahnhof?
bar-6da08c4012dad61d6b7ae4d2b1e44982	I bin a ganz normaler Büroangestellter.
bar-3b35969d1ad03114ca871efd313029d3	I hob zwoa Krapfen gessn.
bar-8fd78704c689f6a0d618e39e99df84b1	I foa gern.
bar-b86282e1e7ebc732efeffe06db31e72d	I liab Di.
bar-a5f609717f6458712903c6c46cf9be58	I hob di gern.
bar-f9778d42289f743d9a55f863c682409c	I hob'n am liabsten.
bar-2099c4b6a8091625f08177ddcc54e747	Es is rot worn.
bar-fe8568bb52324deaa6a5b319eba29b16	Da Tom hod ois Weh ausghoidn.
bar-883b4b489a65cefc1d5965ee8e07d4c2	Des Hotel, in demma letzten Sommer g'wohnt ham, g'hört etz'n Tom.
bar-fdf7fc3349b440cdde7bb055228cce40	Des kriagst scho mit da Zeit raus.
bar-e95df17d5640dc9bab92f8724545f27d	Do red scho wieda da Macho aus’m Tom.
bar-331f70c6bd20cdc91cbe729a4b43eef5	Da Fuji is ungefähr viermoi so hoch wia da Rokkō.
bar-9dee55c4400a855163480bd55f0e93f9	Dem Tom sei Hund, dem geht's scho guad.
bar-167b0b0af57b06fce20b538a38e30588	I hob mi an ihre Worte erinnert.
bar-0ba229efde4ae28498d3f6634e9fd758	Wos fia a schmale Stieg!
bar-9324f70c77f84c943400c4394fd050c2	I hob eam klarg'macht, dass er net erwünscht is.
bar-ed231d751532f4e1fadf70583aadb639	Da Tom werd do ned übernacht'n.
bar-68d1e861261cb4fd3bf046c58b9d1ded	Du bist narrisch!
bar-547fdc0a8ac823028a293d68906ddd77	I gfrei mi ned grod für Gschichtn.
bar-bb62b75d8c3c9902941bff1af8113028	Se ham g'probiert, z'samm a Lösung z'finda.
bar-33f91371a4dff4292fb9218ea444272e	Mia ham no vui z' doa.
bar-b29ffbb5f44c63de31abe206cb279940	Es wartn no vui Aufgabn auf uns.
bar-d1280a73b0b023f3d2d00f988c1d5546	Du hast sakrisch recht g'habt!
bar-ba7a74e27f6992ea713c3893a215e0dd	Manche seng zwar d'Ent, aba des Kaninchen seng fallt eam schwer.
bar-cd3fa852a721b29a37b77326d6e3c73b	Du musst es ma gönna.
bar-ee290b7d4c4210e4e6cf814b3d42eb75	I kimm auf koan Fall.
bar-5ef99a62d077990915e648559ec4153c	Vui Projekte geht am End d'Luft aus, während andere no ned amoi aus de Startlöcher kemman.
bar-028834346d8dcc4e113a7f8765e503a6	Mir dank ma dir, dass'd frogst, statt wos ozzunemma.
bar-1c423790d65bb885dbc532031e345d68	Ganz davon abgsehn, dass ma zu mehr Klicks gzwunga warad, dad si's a negativ auf d'Entdeckbarkeit auswirkn, wenn ma de Einträge aus'm Menü rausnimmad, weil wenn ma's ned drin sieht, könnt ma mein, es gibt de Funktionen goa ned.
bar-4a80ce438f72431dad6a1f372c45ffc5	Weil da Tom eig'laden worn is, san a vui kemma, de goa ned eig'laden worn san.
bar-768c871ffaa3c99cbc0382404aa54177	Des Hotel is am End vo da Straß.
bar-827300fb8db5a27fe26edbb31d2844d9	"Sog dem Tom, i kimm", hod da Johannes gsagt, und is aa losganga, oba in de entgenga Richtung.
bar-78c75075022f4cb56bb6a60831e9c134	Beim Inlineskaten ziag i ma Knieschoner o.
bar-aabd41a7ab76412607d2742b2ee717ac	Könnt's ma d' Fundstell' zoagn?
bar-53709351f70ea5047657637fcab5f797	Hobts de Fundstell gsichert?
bar-dd9f2610f6a5994282b7edaa056fbebf	I geb Ihna de Frühstückskartn.
bar-a9e1f92e994394bc5b58a782b4604103	Damit kinna Sie morgn friah am Buffet gratis frühstücka.
bar-5f813e9b8715ad971182f92a9ee41298	Wenn's Frühstückskarten habt, könnt's do umsonst essen.
bar-557e3ecf2a656d5da62ea779515ec855	Ohne Knieschoner geh i ned Inlineskaten.
bar-ebc09f4086cc92052f95a8290f45cc9d	Manche Leit tragen sogar beim Radlfahrn Knieschoner.
bar-cdd3c1eec165450b20ad5a9da3eea5c5	Knieschoner schützn d'Knie bei am Unfall.
bar-c211c66074981b0c9949ebaff5283e06	Dea Dauersound vo da Party nebanan geht ma sakrisch auf d'Nerven.
bar-8da3abdb7e592f3c4e4ef1375d0cd089	I hob a Hausti mit großen Ohren, des hoaßt Elefant.
bar-6ea31cff4a753be0099871deb2289a9d	No nia hod ma g'hört, dass a Heiliger an Löwen umbrocht hätt, an Drach'n aba scho.
bar-2919a54dfd6666d3294d3cde24047228	Da Bildungsipfl is a Bildungshügale worn.
bar-e42ebc971177e4d1ecba2c22b251b1f1	D'Übertreibung is a Wahrheit, de d'Geduld valorn hod.
bar-e2b0fc61292c5b5c63a0039f3524b52b	Vertrau'n is a Oase vom Herz, wo die Karawane vom Denken nia hinkimmt.
bar-27b1c54a7bad639a09e4495363b3de2f	Wenn di Liab da zuawinkt, dann foig ihr, a wenn ihra Weg schwår und steil san.
bar-1aeba36e7cad59814e803e6fefe447f1	Schönheit is d’Ewigkeit, de si in am Spiegel o'schaut.
bar-07e465a1bb42f2d55876c82146599b94	Bist du a Politiker, der frogd, wos dei Land fia di duan ko, oder a g'fiada, der frogd, wos du fia dei Land duan kannst?
bar-f7fc74fe352ab26e22cf97907cec0bec	Wennst da erstere bist, dann bist a Schmarotza; bist da zwoate, dann bist a Oase in da Wüstn.
bar-62575f4dfeeb63e56a050770384b7c5e	Liebt's eich, aba macht's d'Liab ned zur Fessl: Lasst's sie liaba a wogends Meer zwischen de Ufer vo euren Seelen sei.
bar-1a11def496ff420884386cba8366efcb	Gebt's eure Herzen aba ned in d' Obhut vom andern.
bar-902858e77d9acd6016bc42c07068079e	Weil nur d'Hand vom Leb'n eure Herzen umfassen ko.
bar-9a96be6b5e6ac01ce5b5bdebbebb113d	Und stehts zamm, aba ned z'na: Denn de Säuln vom Tempel steh'n für si, und de Eich und de Zypresse wachsn ned im Schattn vo da andern.
bar-5c6843f73b0ac04b43177b3d42f6e31b	Mei Schwester handelt mit Küchngschirr.
bar-92673720d52af353446bbb69dad668c4	D' Maria is oiwei lustig.
bar-5ee12842c9fb4f9985f3370a575a8110	Mei Bruada sammelt Briemmarken.
bar-f9086889c40c7741642361b4c17b52f2	I meid' Komplikationen liaba.
bar-93b935aa887745af1590086aa061807c	De Suppe is eiskoid!
bar-fa7a30b6fafb83d4594cf6b4fa32bc65	Wer hod da denn des Gschmarri verzählt?
bar-3c14c10ca6dd0fb8c1a84ccc4ef08a62	Braucht's a oabatserlaubnis?
bar-c89cdac7ab059c2913daa9a8da339dd5	Dea Herrgott in mir redt mit'm Herrgott in dir.
bar-731d5fdd59822efb83e6257274c76964	Se hod gsagt, sie liabt mi.
bar-ae83c8b4f801d90691756913eccc51b6	I muaß jed'n Dog durch d' Stodt durch, dass i zur Arbeit kimm.
bar-7da65fd1c7746d663f4621bb28ac811e	Des Viertl in Paris is recht berühmt.
bar-e8b789130719962e66876994597aec65	Wos für a scheena Dog!
bar-7148e87ef4dfb858c0c2504a5f75df7d	I gfrei mi narrisch, dass'd ma Blumen schenkst.
bar-f369259d35a4ded16b5a899cca7594c8	Da Tom arbeitet an technologischen Innovationen.
bar-c4ae621f4aebd5f87d099fd24fbdd886	I bin recht zfriedn mit de Blumen, de wo'd ma g'schenkt host.
bar-c9ca82218e198e3604a2dda28b275ec2	I woaß ned, ob olle Roboter so faul san.
bar-8ebc78dd213a1e3a3cfdc2cc2f86195d	Da Moing graut und's is bald Zeit zum Aufsteh.
bar-52d83e5e200c437f2b58731a8c92244e	Wia hoaß is des Ding?
bar-07d9c6f877ae58ae817e83db4eabf13f	I hob scho verstandn, wos'd moanst, oba dei Grammatik is falsch.
bar-f17445dd34a48b81a36d2bcd36ad9351	Do is hoid, d'Temperatur is 26 Grad.
bar-72f5422e8843ad7cb1cac417cdd5ab46	I wui mitm Latein lerna oafanga.
bar-8ccf82fe9fb9bcda4c55568db16ee56c	D'Maria schafft an Finanzinnovationen.
bar-92eb3c9581134bfbe37ab510c73579a7	Da Tom macht bei de versprochene Verhandlungen mit.
bar-bb71791f41a0154006c79b9964b17954	Es is da Anfang vom Jahr.
bar-ba7c89c93f2e8cda90de4de05fd2554a	Ned alle Rosen san rot.
bar-761d817873cfcda13ba733703d073d96	Wer hod da so an Schmarrn verzählt?
bar-c6ce63128f152f333f61fb298577f97e	Des Hotel is achthundert Meter vo do weg.
bar-6c3af0ffb8caaecc969009d930a86f33	Des Wirtshaus is zwoa hundert Meter von meim Büro weg.
bar-c68d9f0c9c4137475ba25da704278e50	Du host nix, wos i hobn mog.
bar-aad9ad8f868cf7dc416b3c200ae6c20e	Hunde san edle G'schöpfe.
bar-99cb290e31dffc27cbaff7cdfa316257	Wenn's a Problem gibt, dann lass mi bittschee wissn.
bar-c88033508dfb9c7b324f0a517b08ffb4	Ma woaß no ned, ob a si's Bei brocha hod.
bar-a77fa1f82f20a2e2355fbf8597e73a50	Er soi g'röngt werd'n.
bar-d887fe2b4500c90b682bbee0346881c4	Sei ernst, b'scheida, höfli, ruahig, wahrhaftig.
bar-dba1f00b90d0a407a021c88a10da84de	Red ned z'vui.
bar-eb32244a31fda4b25817ea7b09137aad	Und nia vo Sach’n, vo denen Du nix woaßt.
bar-258c41c0a439b97c7963b203adb71d2b	Da vielleicht greßde Vorteil vom Ruahm is, dass ma ungschoidn de greßdn Deppenheiten sogn derf.
bar-c50f1711e6e602b3bb2040fd41e4e615	Ohne Stoi, wo er aufleuchtet, warad da Lichtstrahl ned sichtbar.
bar-7b4f6ac007618aeb85fa508085be97af	Am Pessimismus g'wohnt ma si z'letzt wia an z'engan Janker, der si nimma änder lassn duat.
bar-4ece95a977904ae3754cb2ae3710763e	A guada Lehrer hod bloß oane Sorg: beizubringa, wia ma ohne eam auskemma.
bar-16c5bc897e48c79de91431b6aa9378a7	Wenn i mit dir schlof, dann is des ned, weil i di liab, sondern weil i ned ohne Weiber auskumm.
bar-b8213de704b33d468101d80a7f04a05c	Is des echt so schwer zum verstehng?
bar-d4660e18e2efcfba78ac5a92d37ebe7b	Es fällt ma sakrisch schwer, mia selba einzugestehen, dass i ned ohne di auskemma.
bar-d5f3164cf29f5aa5ffea33e7f4eeae54	D' Maria mog's ned zuegebn.
bar-bdb512ff4ad61144b8b920d4dd40fa97	I hob'n Tom ned umfalln seng.
bar-381f3d4276e8f3ded48be6df297384f3	Wia'd seng kannst, hob i mi a drum g'kümma.
bar-3c12c8548fdb2fa7558cbc90658c5772	I hob gmoant, i hätt mei Schlüssl valorn.
bar-d604bf3b05ff0b91eba086157827ceea	Wia i heit in da Fruah kemma bin, war bloß da Tom im Büro.
bar-572ef20775efc1e2ec97ba877800723f	Sei Herrschaft war recht despotisch.
bar-4bed90b94b9df53207d5a2d5e1afea63	I kimm aus da glei'n Stod wia sie.
bar-97be8e79c2ce012cd4896c1f9a09998a	D'Maria hod si de Autoschlüssel vom Tom g'holt.
bar-1d043485699e7df6bed8894b4b8f6ff9	Nilpferd san mit de g'fährlichst Viecher in Afrika.
bar-b416f2cf94684f9356d15d59fa21e44a	D' Maria hod de Warnhinweise ignoriert.
bar-826a3e06f290733996919e0c47472064	Da Tom is ma sehr wichtig.
bar-4ef8d74a29fd8d628b011dac47034a30	Wennst di ned glei ohne a weiteres Wort schleichst, dann hau i di um!
bar-16f733949abda80a453df9767a02a0b4	I wui ned, dass es ois wissn.
bar-d7bf16a056aafc3c8220a411a0c6591a	Mei Eltern san zu mir im Vergleich zu meim Bruada ungerecht.
bar-162f21b42c5bbf6a7597ca3b4c65fe47	I hob a Kätzal aus’m Tierheim g'rettet.
bar-8a1670334fb46df15d61904ab4e61369	A Grimoire is a Zauberbuach.
bar-5fcdde5329d4d99d771ef4f5e19f1b40	Da Peter da Grausame is aa ois da Peter da Gerecht bekannt.
bar-d3de5d7090b529a9ec8c0c21d6e2ef5b	Da Tom hod d' Maria in d' Arm gnumma und ganz fest druckt.
bar-6ebf6cbf92f34a5af9e4d6cf1e1440fe	So hamma des oiwei g'macht.
bar-d76d6da3d29892a6de5432f056c13613	Im Lebn gibt's mehr ois bloß Gaudi.
bar-07323caa410aa40865eb7ee728de2dcd	I g'frei mi narrisch, dass'd kemma bist.
bar-5ce81b7d47844bab1a4c39f3c58823cb	Da Tom und d' Maria ham si allmählich inanand valiabt.
bar-17e71ab02450987b19085f5e8ed938c4	Da Johann hod a Regal baut.
bar-9923bd3b2b5beac28353b99b13547b09	De Katz is durch'n Zaun gschlüpft.
bar-75d9be1ed95087fbb1b39d3564c579ba	Räum dei Spuizeug auf!
bar-e262812c0fb89b3d4b3fbc3a115ac0d3	Da Tom is grennt, wia wenn da Deifi hinter eam her warad.
bar-8a4367c0803c73605a7e73e356b209c4	Was is mit dem Beamer dös?
bar-16c467e35e54b6794f1f70c42483e347	Da zeigt gar nix o.
bar-98055d5c422e18f39fdc86e53a9f5b6b	Mir ham miteinand telefoniert.
bar-96e84d32399143141b2f2363fa1fc1c7	Ohne sei Lieblingskuscheltier ko Tom ned ei'schlafn.
bar-e662528155faec9b787f567c77b107b2	Des is a recht fade, aba recht oafache Arbeit.
bar-0aeb6f7f0a3cbbde9aa554dbf1c14cf5	Mei Freind san do.
bar-054c5aad9cf77a6f8f8c42e97441e490	Jeds Viech braucht Futter, Wasser und a Tierheim.
bar-f9aff9507eadf70d51a3b1aa860bc6f2	I hör Musik und tanz.
bar-7afb01b109df0aad046f3850c83f96d7	Rot, Gelb und Blau san Farben.
bar-37163d8f5e19a693fd47a2f4f7e194b4	I hob an nix anders denka kenna.
bar-321d843ef58d97d99d1684bb78c9e412	Mogst ma's verratn?
bar-b41d6bdedb13f7b9793463fa4ee5e3e7	Des kimmst nia drauf!
bar-192c0ca1bb57494a4c24c853fe68331e	Mensch, reg di ned auf!
bar-c502e62755c690d4650efc5d455b89e3	Wer hod d'Antwort erraten?
bar-39381637d5afc61df46d9c37a97c4e7a	Du kannst de Bücher alle wegschmeißen.
bar-a69a9d5ee56e902f3d52e7e58c8d0d42	I gspür des kalte Wasser und de wam Luft.
bar-14ac5f5a7783b937cd6af642d44c4781	Is Französisch a leichts zu erlernende Sprach?
bar-2c876aea7d968c36a86cc7f9320141a2	Dei Birn is faul.
bar-f6f034e9929af92ca44bbebcddd6fccd	I mog de Gmoa Toki Pona.
bar-7a028b1de28a68d369de00d7e51e3164	Ned alle Schlang san giftig.
bar-fba2dc8970b2af4e3779a9faf54b57bf	De Schlang is g'iftig.
bar-11ab1bbe25f6676b515456916f0f6324	D'Elena war des erste Kind von Eltern, de olle zwoa scho amoi ins Weltall g'reist san.
bar-d1cf6f15ede100130fb8d3c774b54065	Dem Tom kimmt's so vor, ois dad sei Arbeit da Gsellschaft nix bringen.
bar-bd1d42d87807613c392dadca693f125e	Da Tom hod g'spürt, dass sei Arbeit da G'sellschaft nix bringt.
bar-b6056865761711440dec7ae183e084ef	„Daran derfst ned denken“, hod d’ Oma g’sagt. „Uns geht’s vui besser, und mia san glücklicher ois de Leit.“
bar-01b4773e9da66787b3cc2a3364f64b35	D' Künstler vo da Renaissance warn vom klassischn Altertum fasziniert.
bar-00b9f45d32c05bdc14e1609730c22965	Da Tom hod sei Teller fast so schnell leer g'macht wia i.
bar-b00b1eab0c12772477177e16437a592e	Da Tom hod ma ned de ganze Gschicht erzählt.
bar-660022389b566dee8b5ee37146608497	Da Kerl is ma z'wider.
bar-02ec6aa6f62296df09575410db1a06b1	Mit dem soi'dst ned z'samm sei!
bar-aaa7a559c61ff1d616b31fe120f25bd8	Mia arbeitn gschwind.
bar-bf6a69c9ebc986f83f94cbf323216381	Könntest des Dokument ins Französische übersetzen?
bar-104ffb7215e628d8c622f976e2849874	Könntst des Dokument bitte auf Französisch übersetzen?
bar-7149f3d25309b91cdb4099577f43f779	Red beim Essen ned über's Gschäftliche!
bar-9a92bfa5b05b792c991782478e5e7fc5	Bitte wart, bis i mit de Hausaufgaben fertig bin!
bar-cba4c0b49f3e4004494093828c5117a1	Schreib' zerscht amoi dei' Nam.
bar-3b0e094e494f133454b801ef1399c064	Am End is nix passiert.
bar-f5a05a34a3a9ea2b18cd3f8998de2ca6	Loss ma morgn grillen, wenn's schee is!
bar-f5a05a34a3a9ea2b18cd3f8998de2ca6	Loss ma morgn grillen, wenn's schee is!
bar-340345537b52bc01835a733bef84a5f4	Da Dokta hod operiert.
bar-9985d6b2b4007e614b5d833be203cf5f	Mir san am Strand entlang ganga.
bar-acd500c6678721ec27541d388f717d59	I hätt no a letzte Frog zu Algerien.
bar-545f378486aaa1271a6e4201a3f54106	In Japan gibt's alle fünf Jahr amoi a Volkszählung.
bar-eea4f481157ab56b943af95e9123fb40	Mogst a Knoblauchbrot?
bar-dd0d3ae8d11a46dbed69611b6b4daf02	I überlass da ois.
bar-4208a90be30834e2b8398129be677796	Loss ma zerscht wos essn!
