QT000009480	Wat för ’n Johr hebbt wi?
QT000009481	Se hett em för all sien Geld nahmen.
QT000009482	Godd is de Anfang von allens.
QT000009483	In en Immenkorv kann ’r man een Immenmoor wesen.
QT000009484	Wao is mien Bril?
QT000009485	Ik geev di, wat du wullt.
QT000009486	He snackt good Engelsch.
QT000009487	Ik heff jüst dit Book leest.
QT000009488	So plietsch un sacht as he is, is disse Hund gode Sellschop för mi.
QT000009489	Ik heff twee Butenlänners kennenlehrt. De eene keem ut Kanada un de annere ut England.
QT000009490	Ik heff em al Johren nich sehn.
QT000009491	Kannst du en Taxi för mi bestellen?
QT000009492	Wo smeckt disse Supp?
QT000009493	De Süstern sünd all beid blond.
QT000009494	Miene Tante leevt in New York.
QT000009495	He is op ’t Partermang.
QT000009496	Wullt du noch en Tass Kaffe drinken?
QT000009497	Wenn man Ies hitt maakt, smült dat.
QT000009498	Disse Boom is höger as all de annern.
QT000009499	Ik heff mien Geld för Kleder, Äten un Beuker utgäven.
QT000009500	De Hälvt von de Schölers weer nich dor.
QT000009501	Worüm maakst du keen Diäät?
QT000009502	Hau mi nich so dull.
QT000009503	De Dokter sä, dat Tom de tokumm Weken in’t Bett blieven mütt.
QT000009504	Se is keen gode Person.
QT000009505	Güstern hebbt wi nich snackt.
QT000009506	Se is na Paris gahn, üm Kunst to studeren.
QT000009507	Wenn use Katten 'ne Kau wör, dann mösten we up 'n Balken taun melken!
QT000009508	Kunn een den Kommentar baven in en Spraak översetten, de ik verstah?
QT000009509	Ik kunn mi nich good noog op Engelsch verdüütschen.
QT000009510	Ik bün mit mien Moder na Disneyland wesen.
QT000009511	He süng un süng.
QT000009512	Ik kann dissen Satz nich översetten.
QT000009513	Se keek em in ’t Gesicht.
QT000009514	Du snackst.
QT000009515	Dreih den Slötel na rechts.
QT000009516	Tom schrifft mi noch von Tied to Tied.
QT000009517	Segg.
QT000009518	Laat dat dicht.
QT000009519	Dor weren alltohoop 30 Maten.
QT000009520	Se mutt smuck wesen hebben, as se jung weer.
QT000009521	Papa kummt morgen na Huus.
QT000009522	En good Woord köst nix.
QT000009523	Worüm hest du ehr dat nich seggt?
QT000009524	Ik bün Engelsch-Lehrer.
QT000009525	He is weg von tohuus.
QT000009526	Ik weet, dat ik goot noog bün.
QT000009527	Wees still un lüüster.
QT000009528	De Maand geiht toenn.
QT000009529	He hau en Telg von ’n Boom af.
QT000009530	He kummt ut England.
QT000009531	Dat is beter för mi, wenn ik en Fisch heff un keen Vagel.
QT000009532	Ik bruuk en Koort.
QT000009533	Ik heff nu keen Tied.
QT000009534	Ik wull geern mit Kreditkoort betahlen.
QT000009535	He leevt op ’n Topp von dissen Barg.
QT000009536	Ik bün bloot en lütten Jung.
QT000009537	Mien grote Süster hett Hoor bet na ehr Schullern.
QT000009538	Een Minuut hett sösstig Sekunnen.
QT000009539	Ehr Hoor weer so lang, dat dat bet an ’e Eer recken deed.
QT000009540	Se deed em winken.
QT000009541	Ik heff en Foto von ehr maakt.
QT000009542	Wat för en plietsche Froo se is!
QT000009543	Se möök em en lecker Mahltied.
QT000009544	Ik heff mien Hannen beven föhlt.
QT000009545	Woveel Johr büst du oold?
QT000009546	Mien Familie hett den Hund dull mücht.
QT000009547	20.000 Daag sünd en lange Tied.
QT000009548	Se schüll em ut.
QT000009549	’Keen is Alvar Aalto?
QT000009550	De Paal von ’e Arvt is gröön.
QT000009551	Se seht sik een Kehr in ’e Week.
QT000009552	Wi sünd in’t Museum.
QT000009553	Se hett dree Bröder.
QT000009554	Se is Dokter.
QT000009555	Mien Roboter heet Maruchi.
QT000009556	Yumi ehr Koreaansch warrt jümmer beter.
QT000009557	He is nich sau dum, äs he uutsüt.
QT000009558	Ik möök de Döör dicht, dat se uns nich hören deden.
QT000009559	He weer al twee Stünnen bi to lehren.
QT000009560	En Bull kann Vader warrn, en Oss bloot Unkel!
QT000009561	He hett dat mit alle Macht oplücht.
QT000009562	Glöövst du an Godd?
QT000009563	Woneem is dat Book?
QT000009564	Dat is doch nich so licht, as ik dacht heff.
QT000009565	Büst du jümmer noch nich weg?
QT000009566	Wat is dien leevste Soort Fisch?
QT000009567	Ik bring ehr di morgen.
QT000009568	Wo geiht dien Famielje dat?
QT000009569	Dat weer kloor, dat se lagen harrn.
QT000009570	He is de Gröttste in de Klass.
QT000009571	’Keen kümmert sik üm joon Hunnen?
QT000009572	Dissen Broder mutt mien Broder schreven hebben.
QT000009573	Hier is mien Rad.
QT000009574	Dor stimmt wat nich.
QT000009575	Wat deist du ’s middags?
QT000009576	Ik bün en goden Jung.
QT000009577	Wat hest du Sünndag vör?
QT000009578	Wi hebbt us antogen.
QT000009579	Dat is nich licht, en Breev to schrieven.
QT000009580	De Katt speelt geern in ’n Goorn.
QT000009581	Wi hebbt keen warm Water, de Röhren sünd kaputt.
QT000009582	Do keem mi en gode Idee.
QT000009583	Dat is en lütten Hund.
QT000009584	De Schoh sünd ut Ledder.
QT000009585	He is keen, op den een sik verlaten kann.
QT000009586	Wo lang kennt ji jo al?
QT000009587	Ik wahn mit mien Unkel tohoop.
QT000009588	Ik heff Pizza bestellt.
QT000009589	Lichter seggt as daan.
QT000009590	De Mann driggt en Brill.
QT000009591	Magst du mi lever raseert oder mit Boord?
QT000009592	Se hett en Katt un twee Hunnen.
QT000009593	Ji verstaht nie mien Jökeleen.
QT000009594	De Inwahnertall stiggt.
QT000009595	Köönt wi mitenanner snacken?
QT000009596	Worüm heet opmaal all Lüüd Tom?
QT000009597	De Regen hett veer Daag duurt.
QT000009598	Laat mi rin.
QT000009599	Ik heff ehr narms sehn.
QT000009600	Ik duusch elk Avend.
QT000009601	Gaht de Kinner na School?
QT000009602	Dat is mi schietegal.
QT000009603	Maria hett blaue Ogen.
QT000009604	Dat is nich licht, mit Kried to schrieven.
QT000009605	De Bläder seilt een na ’t annere an ’e Eer.
QT000009606	Wannehr büst du trüggkamen?
QT000009607	Magst du Horrorfilme?
QT000009608	Mi hett en Katt kleit.
QT000009609	Ik will geern de Bööm sehn, von de du disse Appels plückt hest.
QT000009610	Is dat de richtige Weg na ’n Bahnhoff?
QT000009611	Uns Fleger weer üm un bi dörtig Minuten laat.
QT000009612	Ofschoonst se Fehlers hett, mag ik ehr.
QT000009613	De Eer is keen akrate Kugel.
QT000009614	Wenn twee sik striedt, freit sik de Drüdde.
QT000009615	Dat is Tied för de Narichten op Kanaal 79.
QT000009616	Sett dien Mütz op.
QT000009617	Ji seht good ut!
QT000009618	He weer to füünsch to ’n Snacken.
QT000009619	All hebbt ehr geern.
QT000009620	Dat is miene Büx.
QT000009621	Hier is en Book.
QT000009622	Dat is en Schipp.
QT000009623	Ik heff dat in ’t Radio höört.
QT000009624	Ik dach, he deed kamen.
QT000009625	Ria wahnt in Kairo.
QT000009626	Japaners hebbt sik fröher vör allen von Ries nehrt.
QT000009627	Wenn ik noog Geld hatt harr, harr ik de Tasch köfft.
QT000009628	Wat fröher mit Peerd un Wagen en Dagreis weer, dat is nu mit dat Auto keen Stünn Fohrt.
QT000009629	Du schusst man dat Smöken opgeven.
QT000009630	Hest du keen Aptiet?
QT000009631	Dit ole Huus is ut Holt.
QT000009632	Tom toog sik an.
QT000009633	Wenn ji klingoonsch snackt, verstah ik dat nich.
QT000009634	Wi sünd Tom sien Söhns.
QT000009635	Güstern heff ik en feine Geschicht höört.
QT000009636	Se sünd Singers.
QT000009637	Segg Nee to Drogen.
QT000009638	Worüm hest du dat vergeten?
QT000009639	De annere geiht nich.
QT000009640	Wannehr kummst du na Huus?
QT000009641	Se hebbt wi lang töven laten.
QT000009642	De Pyramiden sünd in ’e antike Tied boot worrn.
QT000009643	’Keen is dat?
QT000009644	Föhrst du mit ’n Bus na Tokyo?
QT000009645	Wi harrn en Barg Möbel.
QT000009646	An ’n Heven fleegt twee Kreihn.
QT000009647	He drinkt sien Kaffe jümmer swart.
QT000009648	Du kannst sitten gahn, wo du wullt.
QT000009649	To’n Glück geiht dat Tom hüüt veel bäter as gistern.
QT000009650	He hett dree grote Süstern.
QT000009651	Dat Lidd lett sik nich afnehmen.
QT000009652	De Heven kloort op.
QT000009653	He güng de Straat op un dal.
QT000009654	Ik heff kole Fööt.
QT000009655	Ik heff de Melk drunken, de von ’t Fröhstück över weer.
QT000009656	Wullt du dat nu sehn?
QT000009657	Hest du Bleestickens?
QT000009658	He weer in Frankriek.
QT000009659	Föhrst du dor mit ’n Bus oder mit dat Auto hen?
QT000009660	Dit Maal will ik en Oog todrücken.
QT000009661	Swemm nich in ’n Diek.
QT000009662	Ik will Tom en beten Geld gäven.
QT000009663	Ik verlaat mi op Tom.
QT000009664	Ik schall so bi Middag mit de Arbeid trech wesen.
QT000009665	Ik heff em veer Dollar betahlt.
QT000009666	Se hebbt al betere Daag sehn.
QT000009667	Segg uns, wat wi nu doon schöölt.
QT000009668	Dat hett nix mit dit Probleem to doon.
QT000009669	Jüst dat is in ’t Düütsch aver ook so.
QT000009670	Hest du anfungen, Engelsch to lehren?
QT000009671	Tom sä, he röppt morgen an.
QT000009672	In dissen Laden warrt keen Alkohol verköfft.
QT000009673	Se töög mi mit ehr Ogen ut.
QT000009674	Nee, Dank ok.
QT000009675	Ik estemeer em temlich.
QT000009676	Wo kummt dat, dat du so veel von japaansche Geschicht afkennst?
QT000009677	Se slöög mit de Fuust op ’n Disch.
QT000009678	Mien groten Broder geiht elk Wekenenn Angeln.
QT000009679	’Keen höört dat Eten hier to?
QT000009680	Holl ut!
QT000009681	He deed sien Arger dalsluken un möök mit de Arbeid wieder.
QT000009682	Wüllt ji mit mi slapen?
QT000009683	Ik reis geern mit mien Auto.
QT000009684	Tom hett mi seggt, wat ji daan hebbt.
QT000009685	Wi weet, dat Tom dat nich doon hett.
QT000009686	In ’e Köök is en Katt.
QT000009687	Ik plan in en Puff te arbeden.
QT000009688	He keem temlich laat na Huus.
QT000009689	He sütt nu veel beter ut.
QT000009690	Se hett em in ’n Zoo mitnahmen.
QT000009691	Dat is in Japan nich de Fall.
QT000009692	Se hett keen Bröder.
QT000009693	Se hett em instellt.
QT000009694	He hett all sien Geld verloren.
QT000009695	Ik heff mien Öllern versproken, se tominnst dreemol in’n Maand to beseuken.
QT000009696	Jo, dat is mien Huus.
QT000009697	He harr en masse Frünnen.
QT000009698	Söss Maand later weren wi verheiraadt.
QT000009699	Keih sünd mehr nütt as elk anner Deert in dit Land.
QT000009700	Ik weer noch nie in Neeseeland.
QT000009701	Ik will nich alleen leven.
QT000009702	Dröff ik dat anproven?
QT000009703	Du speelst good Tennis.
QT000009704	Ehr Koken smeckt good.
QT000009705	Ik leev in Canton.
QT000009706	De Dichter schrifft veel Dichtels.
QT000009707	De See is för de Fisch, wat de Heven för de Vagels is.
QT000009708	Wi hebbt em na Hülp ropen höört.
QT000009709	Nachtens sünd all Katten grau.
QT000009710	Tom is noch in ’e School.
QT000009711	Dor is en gele Roos.
QT000009712	Ik weet noch sien Gesicht, aver nich mehr sien Naam.
QT000009713	As Kind harr ik ook en Modelliesenbahn.
QT000009714	He hett en behöllern Kopp.
QT000009715	He is ut en annere Welt.
QT000009716	Wi harrn veel Möbels.
QT000009717	Ik heff en Granaat.
QT000009718	Ik will ehr freen.
QT000009719	Kaam mit.
QT000009720	De Daak deed gau dichter warrn.
QT000009721	Ik bruuk dien Hülp.
QT000009722	He wahnt dor ganz alleen.
QT000009723	Egaal, wo dicht du weerst, Goethe weer Dichter!
QT000009724	Ik heff em nie singen höört.
QT000009725	Worüm kummst du nich eens vörbi?
QT000009726	Wat för en CD wullt du anhören?
QT000009727	Uns Schoolmeester is kamen.
QT000009728	Hebbt ji dit Wekenenn Tied?
QT000009729	Ik leev för een Maand bi mien Unkel.
QT000009730	Dat is to lütt, üm op dien Kopp to passen.
QT000009731	Hest du en egen Kamer?
QT000009732	He versteiht gorkeen Franzöösch.
QT000009733	Kiek di dat noch wedder an.
QT000009734	As ik lütt weer, harr ik en Goldhamster.
QT000009735	Astronomie hannelt von Steerns un Planeten.
QT000009736	Ik fraag ehr, wat ik dat Book lesen kann.
QT000009737	Ik kenn Tom sien Süster.
QT000009738	Kann ik en Naricht dorlaten?
QT000009739	Ik hör Stimmen.
QT000009740	Kummt he hier elk Week her?
QT000009741	Dor sünd en poor Appels in ’n Korv.
QT000009742	Ik bün fievunveertig Johr oold.
QT000009743	De Laag is so al leeg noog.
QT000009744	Dit Metall warrt Zink nöömt.
QT000009745	Ik kann nich seggen, dat Herr Kelly dat Leven von en Hilligen föhrt hett.
QT000009746	Ik kann nich flegen.
QT000009747	Dat hebbt se mi nich seggt.
QT000009748	Mary is jüstso groot as Tom.
QT000009749	Uns Tog höll opmaal an.
QT000009750	Vör lange Tied hett dat hier maal en Brügg geven.
QT000009751	De Reinmakerfroo deed dat Gespreek ünnerbreken.
QT000009752	He smöökt nich.
QT000009753	He deed en Poor Söcken utsöken, de to sien Antog passen deden.
QT000009754	De dicken Lienen op de Koort sünd Weeg.
QT000009755	Tom hett noch veel to lehren.
QT000009756	Séamas Mhicí Sheáin is vergangen Johr doodbleven.
QT000009757	Disse Döör lett sik nich sluten.
QT000009758	Büst du mit ’n Dummbüdel kloppt?
QT000009759	Du un Brenda, ji sünd nich hungerig.
QT000009760	Mak keene Fisematenten!
QT000009761	Ik mutt miene Moder helpen.
QT000009762	Ik begriep, wat du seggst.
QT000009763	Ik bün jümmer hungerig.
QT000009764	Kannst du mi dien Book lehnen?
QT000009765	Würklich? Du süst jünger ut.
QT000009766	Tom kann jüstso good Ski föhren as sien Broder.
QT000009767	Ik föhl mi jümmer mööd.
QT000009768	Ik heff mien Wecker mitbröcht.
QT000009769	Ik heff keen brede Huffen.
QT000009770	„Tatoeba“ is japaansch för „to ’n Bispeel“.
QT000009771	Se keem na Tokyo as se achtteihn Johr oold weer.
QT000009772	Wat schall ik äten?
QT000009773	Se is en beten krüüsch bi dat Eten.
QT000009774	Spaniers hebbt twee Achternaams.
QT000009775	Se wüssen nich, wat se toeerst doon schullen.
QT000009776	Hier is en Foto von ehr.
QT000009777	He müch de School nich.
QT000009778	Ria weet, wat se will.
QT000009779	Legg de Eier in dat kakendige Water.
QT000009780	Dor kann di nüms hören.
QT000009781	Ik hoff, dat Tom nich denkt, dat wi em nich afkünnt.
QT000009782	Ik heff nu nich veel Tied.
QT000009783	Worüm sünd ji so trurig?
QT000009784	Mien Küssen röppt un dat heff ik noch nie nich töven laten!
QT000009785	In ’t Radio löppt bloot Schiet.
QT000009786	Worüm hest du mi ropen?
QT000009787	Se lees em en Gedicht vör.
QT000009788	Se füng an to singen.
QT000009789	Ik mutt nu loos.
QT000009790	Ik will di beter kennenlehren.
QT000009791	Wannehr büst du ankamen?
QT000009792	Ik bün hungerig. ik heff keen Middag eten.
QT000009793	Ik bün en Künstler.
QT000009794	Ik kann mi besinnen, as wenn dat güstern wesen weer.
QT000009795	Siene Hannen weren leddig.
QT000009796	Ik mutt bet Klock söven wedder bihuus wesen.
QT000009797	Wi töövt al en halve Stünn op di.
QT000009798	Ik heff en poor Frünnen.
QT000009799	Ik bün Maandag na Boston föhrt.
QT000009800	De Kinner speelt mit dat Speeltüüg.
QT000009801	Ik gah kuum in Bökereen.
QT000009802	Dat is nich noog to wullen, een mutt dat ook doon.
QT000009803	Ik hör nie wat.
QT000009804	Ik wull lever dood wesen as di to freen!
QT000009805	Worüm seggst du nix?
QT000009806	Dor kummt nix Goods bi rut.
QT000009807	Ik will en poor Kartuffeln.
QT000009808	Ik kann nich na dat böverste Fack recken.
QT000009809	Dat gifft keen Grund, dat he Bott geven schull.
QT000009810	Tom is grood in’n Goorn.
QT000009811	Se plaant en Reis.
QT000009812	Kunnst du gistern mit Tom kören?
QT000009813	Eet wi nu?
QT000009814	Worüm maakst du dat?
QT000009815	Ik mag hitten Tee lever as kolen.
QT000009816	Atooms sünd överall in.
QT000009817	Dor isset.
QT000009818	Ik heff mi jüst sneden.
QT000009819	De Lamp hängt von de Deek dal.
QT000009820	De Jäger hett ’n Voss fungen.
QT000009821	„’keen söcht, de schall finnen“, sä de Wiese.
QT000009822	Ria teek en Huus un en Boom.
QT000009823	Du süst bleek ut. Nehm di opbest en Dag free.
QT000009824	Se is en gode Kööksch.
QT000009825	Söök un du schasst finnen.
QT000009826	Se mutt mit en ring Inkamen utkamen.
QT000009827	Wat bedüüdt dit Woord?
QT000009828	Een wennt sik an allens.
QT000009829	He is groot un se ook.
QT000009830	Dat Leven is nich gerecht.
QT000009831	He holl op, dat Daagbladd to lesen.
QT000009832	Gilles lööp över de Dünen.
QT000009833	Frankriek weer in ’n Krieg mit Russland.
QT000009834	Kaam mit dien Oors ut ’e Puuschen!
QT000009835	He hett schon jau seggt.
QT000009836	Kann een dor wat to eten in köpen?
QT000009837	Sien Wunn blöddt.
QT000009838	Dat fallt mi swoor, dat Book to lesen.
QT000009839	De Deern mag geern Peer.
QT000009840	Se farvt sik jümmer de Hoor.
QT000009841	Ik kiek nich geern Films.
QT000009842	Wannehr is düsse Boom plant worrn?
QT000009843	Ik heff vonnamiddag keen Tied.
QT000009844	Gah trügg op dien Platz.
QT000009845	Güstern heff ik dree Stünnen lang mit mien Fründ snackt. Wi hebbt uns een Week nich sehn.
QT000009846	Tom froog Ria, of he se küssen dröff.
QT000009847	Worüm hett mi keeneen seggt, wat ik doon schall?
QT000009848	In ’n Winter barst uns Lippen.
QT000009849	Richtig!
QT000009850	Wat schall ik doon? Ik heff to nix Lust!
QT000009851	Ik heff en Ramm in ’t Been.
QT000009852	Worüm wullt du in ’t Butenland studeren?
QT000009853	Mien Naam is Henry.
QT000009854	Ik bün en beten grötter as du.
QT000009855	Wo lang büst du al mit Jane verheiraadt?
QT000009856	Schalke speelt vonavend gegen Inter Mailand.
QT000009857	He leevt buten de Stad.
QT000009858	Poppeer warrt von Holt maakt.
QT000009859	He weer nich in ’e School, denn he weer krank.
QT000009860	Se kann wieder swimmen as ik.
QT000009861	Bi en Noodfall, roop 119 an.
QT000009862	Ik heff jüst eten, ik heff keen Hunger.
QT000009863	He stünn op.
QT000009864	Wo mehr wi lehrt, wo mehr weet wi.
QT000009865	Ik heff en Schetter.
QT000009866	Höör dor mit op!
QT000009867	He deed sien Arm hoogböhren.
QT000009868	He maakt dat Finster op.
QT000009869	Se gefallt mi temlich good.
QT000009870	Do et süms.
QT000009871	Ik heff ehr för teihn Dollar verköfft.
QT000009872	Glenn hett twee Fründinnen.
QT000009873	Wat hett he söcht?
QT000009874	Wenn ik wat nich utstahn kann, denn is dat, de Huusslötels to verleren.
QT000009875	Wo mehr wi lehrt, wo duller markt wi uns egen Unweten.
QT000009876	De Penn is harter as dat Sweerd.
QT000009877	Ook ik heff maal lütt anfungen. Vondaag höört mi de gröttste Hannelskeed in Öösterriek.
QT000009878	Söökt ji wat?
QT000009879	En Buddel steiht in ’t Köhlschapp.
QT000009880	Een kann keen twee Saken opmaal doon.
QT000009881	Ik heff jüst Sushi eten un Beer drunken.
QT000009882	He hett mehr as noog Geld.
QT000009883	He fröög mi, wat ik chineesch Eten mag.
QT000009884	Se deed luder warrn.
QT000009885	Ik heff hiut den ganzen Dag tohuus verbröcht.
QT000009886	Jo, en lütt beten.
QT000009887	Ik heff en Hartanfall hatt.
QT000009888	Woneem wahnt Iain?
QT000009889	He is mien Naver.
QT000009890	En Mund kann lachen, ok wenn dat Hart weent.
QT000009891	Dat Huus weer von Feller ümgeven.
QT000009892	Wi müssen lang op ’n Bus töven.
QT000009893	In ’n Harvst warrt dat Loov rood un geel.
QT000009894	Ik kann di opstunns nix vertellen.
QT000009895	Wies mi op de Koort baven, woneem Puerto Rico liggt.
QT000009896	Ik ligg op mien Bedd.
QT000009897	Wenn een doodblifft, is een denn neger bi Godd, vonwegen dat di dat nich mehr gifft?
QT000009898	Jümmer to Deensten!
QT000009899	Dat is temlich düür.
QT000009900	Ik will weten, ’keen kamen is.
QT000009901	Worüm büst du güstern nich kamen?
QT000009902	Ik heff keen Boorgeld.
QT000009903	Dat is man en Speel.
QT000009904	Ik loop.
QT000009905	Dat smeckt sööt as Sucker un Tittmelk.
QT000009906	Sien Leven is in Gefohr.
QT000009907	Sett ehr keen Grappen in ’n Kopp.
QT000009908	Dat is jümmer goot, de Wohrheit to kennen.
QT000009909	Na, denn bedank ick mi ok.
QT000009910	Ik weer dwungen, ehren Vörslag antonehmen.
QT000009911	He möök sien Ogen dicht.
QT000009912	Du kannst mien Schrievdisch bruken, wenn du wullt.
QT000009913	’Keen magst du lever: de Giants oder de Dragons?
QT000009914	Du musst Klock söss opstahn.
QT000009915	Ik bün dat Klima wennt.
QT000009916	Ik duusch mi jüst.
QT000009917	Op dat Pult liggt en Appel.
QT000009918	Ik wahn in Tokyo.
QT000009919	Tom snackt al wedder in’n Slaap.
QT000009920	Ik heff jemehr Naams vergeten.
QT000009921	Hest du hier wat verloren?
QT000009922	Se kreeg jümmer, wat se wull.
QT000009923	Wo kummt dat, dat du dat nich weetst?
QT000009924	Du büst ja temlich riev mit dat Drinkgeld.
QT000009925	Reekners spoort uns veel Tied un Arger.
QT000009926	’Keen in de Kark geiht, glöövt an Godd.
QT000009927	He und se sünd lieker groot.
QT000009928	Dit Auto is en Hümpel Schrott.
QT000009929	Se geev mi en Teken, dat ik swiegen schull.
QT000009930	Wi hebbt dat, wat wi bruken, nich kregen.
QT000009931	Dor is en Hoor in mien Supp.
QT000009932	Lehr toeerst de Formel butenkopps.
QT000009933	Wo is denn dat Book henkamen, dat ik jüst hier henleggt harr?
QT000009934	He sütt oold ut för sien Öller.
QT000009935	De April maakt wat he will.
QT000009936	Ik heff se nich froogt.
QT000009937	Tom is 2009 doodbleven.
QT000009938	Dat sünd Tom siene Slötels.
QT000009939	Wullt du en beten Melk?
QT000009940	Se itt geern Ies.
QT000009941	Dat sünd miene Öllern.
QT000009942	Uns Lehrersch sütt heel jung ut.
QT000009943	Du bruukst nich na ’n Tähndokter gahn.
QT000009944	Du hest Glück hatt, dat he di nich beten hett.
QT000009945	Segg ehr dor nix von.
QT000009946	Se hett mi leef, un ik heff se ok leef.
QT000009947	Swevel warrt bruukt, üm Swevelsticken to maken.
QT000009948	In Japan gifft dat veel warme Borns.
QT000009949	Ik frei mi so för di.
QT000009950	Tom keem en halve Stünn tau laat.
QT000009951	Du lüggst.
QT000009952	De kranke ole Mann weer in Wohrheid ans nüms as de Buddha.
QT000009953	Kate mutt woll krank wesen, de sütt ja so bleek ut.
QT000009954	Drinkst du Alkohool?
QT000009955	Nüms weet, worüm as he de Stad verlaten hett.
QT000009956	Maak dat Finster nich apen!
QT000009957	Wi mööt Tom övertügen, dat he de Wohrheit seggt.
QT000009958	He schient geern to överdrieven.
QT000009959	Se deed sien Wunn versorgen.
QT000009960	Hest du Medizin gegen Hoosten?
QT000009961	In ’t Vörjohr warrt dat warmer un warmer.
QT000009962	Ik bün na ’n Markt gahn.
QT000009963	Dit Wöörbook hett nich mehr as 20.000 Wöör.
QT000009964	Segg mi dat nich!
QT000009965	Ik heff to veel Böker.
QT000009966	Ik betahl de Reken.
QT000009967	He fehlt faken in de School.
QT000009968	Wo laat is dat nu in San Francisco?
QT000009969	Ik will geern en Bus hüren.
QT000009970	Se hett em drückt.
QT000009971	Dat regent den ganze Dag sachten.
QT000009972	Wees nich bang.
QT000009973	Dit Steak is jüstso taag as en Schohsahl.
QT000009974	Jack is nich hier.
QT000009975	Se küßte em up’e Wangen.
QT000009976	He is Armeeoffzeer.
QT000009977	Tom is temlich swipp.
QT000009978	Ik heff dree Hunnen.
QT000009979	He hett en groten Fehler maakt.
QT000009980	Ik mag dat Vörjohr.
QT000009981	He bruukt en Brill.
QT000009982	Gold rust nich.
QT000009983	Dat ole Poor harr keen Kinner.
QT000009984	He hett wedder sien Regenscherm verloren.
QT000009985	Wat deist du dor?
QT000009986	’Keen wullst du dat verköpen?
QT000009987	Se geiht na School.
QT000009988	Een Spraak is nie noog.
QT000009989	Indien is 1947 von Grootbritannien unafhängig worrn.
QT000009990	Tom hett noch mehr Fragen.
QT000009991	Pass op, wat he seggt.
QT000009992	Woneem is he?
QT000009993	De Froonslüüd speelt Tennis.
QT000009994	Dor nich för.
QT000009995	He steiht op de swarte List.
QT000009996	Ik do keen Sucker in mien Koffie.
QT000009997	Regeln sünd allens oder nix.
QT000009998	Ik heff Tom nix to seggen.
QT000009999	Ik heff jüst Sushi eten un Wetenbeer drunken.
QT000010000	Ik wull geern miene amerikaanschen Dollar in Euro wesseln.
QT000010001	Gah lever na Huus.
QT000010002	Laat uns dissen Weg gahn.
QT000010003	Villicht stimmt dat.
QT000010004	Kannst du uns Handsteen repareren?
QT000010005	Se vergitt jümmer mien Telefoonnummer.
QT000010006	Se hett em en Ticket köfft.
QT000010007	Se geven jemehr Höpen nich op.
QT000010008	Wat is dien leevst Gedicht?
QT000010009	Ik kann dat.
QT000010010	Ik kenn ehr gornich.
QT000010011	Ik kann mien Brill nich finnen.
QT000010012	He smeet en Steen in ’n Diek.
QT000010013	Wi importeert Kaffe ut Brasilien.
QT000010014	De Hund is bruun, lütt un dünn.
QT000010015	Dit Fohrrad höört mien Broder to.
QT000010016	De Kinner boot en Sneekeerl.
QT000010017	Mien Froo hett vergangen Week en Kind kregen.
QT000010018	Ik seeg den Fleger dat Gebüüd binnenstöten.
QT000010019	Ik fraag mi, worüm de Eier in ’t Dutz verköfft warrt.
QT000010020	Katten möögt lever Fisch as Fleesch.
QT000010021	Du büst uns nee Naver.
QT000010022	Se hett jümmer wedder seggt, dat se unschüllig is.
QT000010023	He is Swiezer.
QT000010024	He weer lieks achter mi.
QT000010025	Ik heff mien Identität verloren.
QT000010026	Kann ik mit mien VISA-Koort betahlen?
QT000010027	Tatoeba maakt süchtig.
QT000010028	He föhrt en olen Yugo.
QT000010029	In ’n Winter warrt dat fröh düüster.
QT000010030	Mien Mann is en temlich goden Kock.
QT000010031	Ik heff nix mehr sehn.
QT000010032	Dat deit mi bannig Leed.
QT000010033	Elk Schöler hett sien Verscheel seggt.
QT000010034	Tom harr en poor Fragen.
QT000010035	Nüms will sien Sätz översetten, vonwegen dat se blööd sünd.
QT000010036	Ik kaam ut Shikoku.
QT000010037	Gifft dat en Dokter an Boord?
QT000010038	Du büst keen Kind mehr.
QT000010039	Wo wören diene Öllern?
QT000010040	Tom kunn nich toslapen.
QT000010041	Ik heff em fraagt, worüm as he so trurig is.
QT000010042	Ik will dissen Film geern sehn.
QT000010043	Ik heff em in ’t Huus gahn sehn.
QT000010044	De veerte Dag in ’e Week is Dunnersdag.
QT000010045	De Schoolmeester deed uns wohrschauen, dat de Test swoor warrn schull.
QT000010046	He hett sik de Hoor snieden laten.
QT000010047	Woneem hest du den Slötel funnen?
QT000010048	Wenn du dissen Satz lesen kannst, denn kannst du lesen.
QT000010049	He is Tennisspeler.
QT000010050	Se hüng den Klenner an de Wand.
QT000010051	De Jung praat as wenn he en Vullwussenen is.
QT000010052	Se hebbt mi narrt.
QT000010053	Ik föhr morgen na Tōkyō.
QT000010054	Ik heff twee Tassen Kaffe nahmen.
QT000010055	Du büst twee Maal so stark as ik.
QT000010056	Disse Maschien is nu al veröllert.
