QT000005605	En fuligen Röök keem ut de Kuhl hoogstegen.
QT000005606	He is mien Naver, man ik kenn em nich all to good.
QT000005607	Ei hebbt veel Tied verloren.
QT000005608	Eerdbeern sünd in ’n Winter düür.
QT000005609	Dat Fröhstück is trech.
QT000005610	De Deern itt Broot.
QT000005611	In ’n Goorn wüss en Karsbeerboom.
QT000005612	Use School wöör nich so groot as diene.
QT000005613	He hett mien Kusine freet.
QT000005614	Tom hett de Kinner vertellt, dat Ria vun’n Boor freten worrn is, man se weer blot in’n Goorn un hett mit Hanna stünnenlang an’n Tuun stahn un snackt.
QT000005615	Maakst du de Döör apen?
QT000005616	Ik slaap nich noog.
QT000005617	Se plätt ehr Hemmen.
QT000005618	Tom kann Mary nich utstahn.
QT000005619	Vonnamiddag will ik Engelsch lehren.
QT000005620	He leevt ganz alleen in ’n Woold.
QT000005621	He möök en Weltreis.
QT000005622	Ik heff di dull misst, as du in Frankriek weerst.
QT000005623	Is Tom noch in sien Komer?
QT000005624	De Studenten hebbt dit Gedicht butenkopps lehrt.
QT000005625	Dao kieks du rin äs ’n Swin in’t Klockwark.
QT000005626	Elkeen kann dat lesen.
QT000005627	En Waterfall von Sweet lööp pieplings mien Gesicht dal.
QT000005628	Du hest toveel Peper rindaan.
QT000005629	Tom driggt jeden Dag en Hoot.
QT000005630	Von ’t Gras is dat Kalv wiss nich so fett worrn.
QT000005631	Vör een, de bloot en Hamer in sien Warktüügkist hett, sütt elk Probleem ut as en Nagel.
QT000005632	Nüms von uns is perfekt.
QT000005633	Disse Klock geiht nich.
QT000005634	He is op een Oog blind.
QT000005635	Segg ees, büst du mall?
QT000005636	De Suppenlepel is jümmer ganz rechts buten.
QT000005637	Wenn de Keks nich so dull verbrennt wesen weren, harrn villicht en poor Lüüd jem eten.
QT000005638	Ik seh den Jung.
QT000005639	Se schell em ut, dat he den Rasen nich meiht harr.
QT000005640	Wo is use Daagblatt?
QT000005641	As wat arbeidt dien Vader?
QT000005642	Langsaam fallt de Bläder.
QT000005643	Jümmer snackt een.
QT000005644	Wo warrt joon Achternaam bookstaveert?
QT000005645	He hett en Hümpel Geld op de Bank.
QT000005646	Se weer de eerste, de em hulpen hett.
QT000005647	Kevin hett en Demantring köfft un hett vonavend vör, Kim en Andrag to maken.
QT000005648	Wi hebbt veel lopen.
QT000005649	Wo good kennst du Tom?
QT000005650	Dat warrt düüster buten.
QT000005651	Ik heff dor wat ganz Dulles sehn.
QT000005652	Kann ik en Stück Keeskoken kriegen?
QT000005653	Steek dien Nees nich in anner Lüüd ehr Saken.
QT000005654	Wat för ’n Verschill is dor twischen en Dörp un en Stad?
QT000005655	Dat is antoraden, de Priesen vörher to verglieken.
QT000005656	Wees mi nich böös.
QT000005657	Dat is en Zitronenboom.
QT000005658	Dor weer en Barg Vagels in ’n Boom.
QT000005659	Speelst du keen Tennis?
QT000005660	He weer en goden König.
QT000005661	Mien leevsten Sport is Football.
QT000005662	Ik segg di allens, Marie!
QT000005663	Mehr as de Hälft von de Inwahners sünd gegen den Plaan.
QT000005664	Sünndag kummt na Saterdag.
QT000005665	De Sünn keem rut un dat Ies deed smülten.
QT000005666	Ik bün Noelia, un du?
QT000005667	Woveel Spraken kannst du flott snacken?
QT000005668	Is dat jümmers goot, de Wohrheit to vertellen?
QT000005669	Wat süst du op dat Bild?
QT000005670	Hest du vonmorgen dat Bladd leest? Dor steiht wat över de Schölers von disse School in.
QT000005671	He mutt ut ’n Süden wesen.
QT000005672	Ik bruuk faken SSH üm von annerwegens op mien Reekner roptokamen.
QT000005673	He speelt elk Sünndag Golf.
QT000005674	We hebbt grade teemlich veel to doon.
QT000005675	Se hett en grote Nees.
QT000005676	Darop kaas du spejn.
QT000005677	Weet een, wo Tom un Ria sünd?
QT000005678	Ik swemm elk Dag.
QT000005679	De Erasmus-Studenten blievt faken mit annere Studenten ut dat sülve Land tohoop.
QT000005680	Ik heff Dana sehn.
QT000005681	Sünd all dor, wi köönt anfangen.
QT000005682	Denn möök he de Döör apen un keem rut.
QT000005683	Ik heff ehren Breev vergangen Week kregen.
QT000005684	Speel nich mit ehr Geföhlen.
QT000005685	Woneem büst du in de dörtig Minuten wesen, de du weg weerst?
QT000005686	Ik wull, ik kunn de verloren Tied wedder good maken.
QT000005687	Disse Hall hett Platz för 2.000 Lüüd.
QT000005688	De Schruuv weer ganz utjackelt.
QT000005689	De Utblick von ’n Topp is temlich schöön.
QT000005690	Wenn ik Tom seh, segg ik em, dat du em söcht hest.
QT000005691	Fiev Johr is to lang üm to töven.
QT000005692	De Sommerfeern sünd vörbi.
QT000005693	Susie hett mi twee Böker utlehnt, de ik noch nich leest heff.
QT000005694	Ik bün op de Söök na ’n Kees.
QT000005695	Jo, he hett dat al schreven.
QT000005696	Wo lang mutt ik noch in ’t Krankenhuus blieven?
QT000005697	Dat is al Dag; de lange Nacht is vörbi.
QT000005698	Se süng beter as he.
QT000005699	Tweehunnerd Dollar sünd en Barg för mi.
QT000005700	He drünk Beer.
QT000005701	Een Meter sünd hunnerd Zentimeter.
QT000005702	Mike töövt ünnen.
QT000005703	Dat is nu jüst en Johr, dat ik verheiraadt bün.
QT000005704	Dit Hotel is beter as dat annere.
QT000005705	To Tied driev ik meist keen Sport.
QT000005706	Se besöcht em twee Maal in ’t Johr.
QT000005707	De Regen güng in Snee över.
QT000005708	Hest du vondaag al in dien Daagbook schreven?
QT000005709	He kunn nich besünners gau lopen.
QT000005710	Disse Popp höört mi to.
QT000005711	Mien Moder kann nich kamen.
QT000005712	Ik snack kuum mit em.
QT000005713	Hebbt ji al eten?
QT000005714	Snackst du Engelsch?
QT000005715	Se kann jüstso gau swemmen as ehr Broder.
QT000005716	Ik geev di dit Geld.
QT000005717	Se weer dumm noog, mit em uttogahn.
QT000005718	Kann ik di üm en Gefallen bidden?
QT000005719	Meenst du nich ook, dat uns Politikers to oold sünd?
QT000005720	Ik bün nich dumm.
QT000005721	He beed ehr, to vertellen, wo se dat Geld bruukt hett.
QT000005722	Op ’n Schrievdisch liggt en Wöörbook.
QT000005723	Wi bruukt Ehr Geld nich.
QT000005724	Wi hebbt en witte Katt.
QT000005725	Ik bün en Bangbüx.
QT000005726	Ik bün sünndaags nich tohuus.
QT000005727	He kunn sien Arger nich dalhollen.
QT000005728	Ik heff dat köfft.
QT000005729	„Schöölt wi Kriegen spelen?“ „Jo, worüm nich.“
QT000005730	Dat maakt mi neeschierig.
QT000005731	Ik heff man een Stück Brood eten.
QT000005732	He maal sien Fohrrad rood an.
QT000005733	Hebbt ji en Auto?
QT000005734	Jo, ik heff söss Maal fraagt.
QT000005735	Se hett mi inladen.
QT000005736	Elk Sünnavend speelt wi Football.
QT000005737	Dat is brüttig hitt.
QT000005738	Dat hett en Eerdbeven geven un denn noch en Tsunami.
QT000005739	Miene Büx sitt temlich lucker, ik heff veel afnahmen.
QT000005740	Ik harr geern ’n Gavel.
QT000005741	Ik heff nich wüßt, dat he verheiraadt is.
QT000005742	De Sünn güng över de See op.
QT000005743	Allens wat ik weet is, dat he ut China kummt.
QT000005744	Du snackst, as wenn du de Baas weerst.
QT000005745	Dat Book köst föffteihn Dollar.
QT000005746	Verlaat di nich op annere.
QT000005747	Ik heff em mit en annere Fru sehn.
QT000005748	Ik kann nich noch mehr Beer drinken.
QT000005749	Wi mööt noch den Haken söken.
QT000005750	He deed mit de Hand utlangen, üm de Pistool to griepen.
QT000005751	Se geev em en Book.
QT000005752	Disse Poggenstohl is nich to eten.
QT000005753	Köönt ji Gitarr spelen?
QT000005754	Wenn du Hülp bruukst, fraag mi.
QT000005755	Slöppst du?
QT000005756	Flensborg liggt an de Grenz to Däänmark.
QT000005757	De Katt kickt na ’n Fisch.
QT000005758	Dat sütt ut as en Ei.
QT000005759	Wi mööt op em töven.
QT000005760	Se hett en temlich gode Fraag stellt.
QT000005761	De Pries för Ries warrt von de Regeren fastleggt.
QT000005762	Se hebbt keen Spaansch snackt.
QT000005763	Katten köönt Water nich lieden.
QT000005764	Denn kaam ik later wedder.
QT000005765	Worüm ittst du keen Grööntüüg?
QT000005766	Ik dach, he wüss allens över Japan.
QT000005767	De Schoh sünd utpeddt.
QT000005768	He hett wat seggt.
QT000005769	Dit is dat Huus, in dat he leevt.
QT000005770	De Nagel güng dör de Müür.
QT000005771	Mi is güstern Avend mien Auto stahlen worrn.
QT000005772	Disse Gitarr is so düür, dat ik ehr nich köpen kann.
QT000005773	Tom snackt nich giern Franzöösch.
QT000005774	Wi stellt nüms mehr in.
QT000005775	Dat is veel!
QT000005776	Hei kamm achter mek door.
QT000005777	Mien Famielje is nich so groot.
QT000005778	Use Maria is in n Kaustall, to n melken.
QT000005779	Snied den Koken mit en Mest.
QT000005780	’Keen ahn Sünn is, schall den eersten Steen smieten.
QT000005781	Na, Schauster, du wut mik wol brüen / Un tellst mik tau den detschen Lüen?
QT000005782	Ik bün in de vergangen teihn Johr nienich krank wesen.
QT000005783	Wi hebbt an ’n Strand speelt.
QT000005784	De Discher mitt den Bodden ut.
QT000005785	Weetst du, ’keen se is?
QT000005786	Laat uns Engelsch snacken.
QT000005787	Mien Katt blafft.
QT000005788	„Kann mi een helpen?“ „Jo, ik.“
QT000005789	Worüm gifft dat Steerns an’n Heven?
QT000005790	Ik heff en Dutz Löpels un twee Dutz Gaveln köfft.
QT000005791	De Soldaten schöölt en Brügg boon.
QT000005792	Wi seten vörn.
QT000005793	Kannst du mit de Schrievmaschien schrieven?
QT000005794	Ik heff merkt, dat du gistern avend nich tohûs wœrst.
QT000005795	Dat was Fohrerflucht.
QT000005796	Wat hest du nich?
QT000005797	Ik will nich, dat he mi findt.
QT000005798	Se müch em von Anfang an.
QT000005799	Mien besten Fründ is jüst in Room.
QT000005800	Wi hebbt in de See swummen.
QT000005801	Ik bün geern in Iesland!
QT000005802	Fransch is ehr Moderspraak.
QT000005803	Deit dat weh?
QT000005804	De Katt hett de Muus freten.
QT000005805	He is en groten Jung för sien Öller.
QT000005806	Ik verstah nich, wat de Autor dor mit seggen will.
QT000005807	Wi hebbt vonavend Tied noog.
QT000005808	He is dat, de güstern dat Finster tweibraken hett.
QT000005809	Een, twee, dree, veer, fief, söss, söven, acht, negen, tein.
QT000005810	Ik haal Glääs.
QT000005811	De Parkplatz köst nix.
QT000005812	Du dröffst nich rechts föhren.
QT000005813	Worüm lüggt se jümmer?
QT000005814	Hest du em al kennenlehrt?
QT000005815	Legg di op de linke Sied.
QT000005816	He hett veel Geld togeven.
QT000005817	Mary is güstern avend laat opbleven.
QT000005818	He hett sik ümbrocht.
QT000005819	Wi hebbt över den Andrag afstimmt.
QT000005820	Dat is nich mien Probleem.
QT000005821	Tom hett keen Kiekkasten.
QT000005822	Ik heff veel an di dacht.
QT000005823	Ik sing geern.
QT000005824	Ik schall di de Ohren langtrecken!
QT000005825	Bi de Rieken lehrt een sporen, bi de Armen kaken.
QT000005826	Ik fraag mi, ’keen dit Auto tohöört.
QT000005827	Nich so gau!
QT000005828	Appeldwatschen Kraam.
QT000005829	Fröher hett Iesland to Däänmark höört.
QT000005830	Een mutt de Döör apen laten hebben.
QT000005831	De Kiekschapp geiht nich.
QT000005832	Wi hebbt uns Hund White nöömt.
QT000005833	Is dat noog Eten för een Week Telten?
QT000005834	Emma hett ’n Nagen op ’n Kopp drapen.
QT000005835	De Fohrer hett von 1995 bet 1999 för Ferrari föhrt.
QT000005836	Wo föhrt disse Tog hen?
QT000005837	De Schaap graast op de Weid.
QT000005838	Ik bün ut Frankriek.
QT000005839	Ik bün nich plietscher as se.
QT000005840	Ik heff dat Licht nich utmaakt.
QT000005841	Na dat Kunstmuseum geiht dat hier langs?
QT000005842	Ik heff keen annern Fründ as di.
QT000005843	Ik will dat nich mehr.
QT000005844	Worüm hest du en Swien mit?
QT000005845	Mi geiht dat slecht.
QT000005846	Se hett en Dochter, de Mary heet.
QT000005847	Segg mi de Wohrheid.
QT000005848	Dit Book is över Steerns.
QT000005849	Mien Dochter geiht to School.
QT000005850	Ik mutt mi raseren.
QT000005851	Grööt dien Familie!
QT000005852	Nüms hett dissen Satz wegdaan.
QT000005853	Een is neet. De annere is oold.
QT000005854	Nu steiht he jüst in de Döör un will in de Kark.
QT000005855	Höör ees!
QT000005856	Nu hebbt se dree Kinner.
QT000005857	Nadat ik TV keken harr, güng ik na Bedd.
QT000005858	Dat Gras is to nat to ’n Hensetten.
QT000005859	Ik heff dat alleen maakt.
QT000005860	Se geiht geern mit ehr Frünn loos dansen.
QT000005861	Dat Telefoon geiht nich.
QT000005862	Nüms glövt mi.
QT000005863	Ik schall an dien Wöör denken.
QT000005864	Dor wahnt Tom un Ria.
QT000005865	Weetst du nich, wat güstern wesen is?
QT000005866	En Möhl kann nich mit dat Water von güstern mahlen.
QT000005867	Hebbt ji dat Finster apen laten?
QT000005868	Dit Woord kummt ut dat Latiensche.
QT000005869	Laat uns för en poor Minuten verpuusten.
QT000005870	Dat is hart för em, mit sien lütte Rent dörtokamen.
QT000005871	Ik heff den Koken ut ’n Aven nahmen.
QT000005872	De Froo wascht sik dat Gesicht.
QT000005873	Worüm büst du so wöterig?
QT000005874	Krieg ik en Narv?
QT000005875	Wi seilt Maandag na San Francisco.
QT000005876	De Mast mutt liek stahn!
QT000005877	Dat Gras von de Navers is alltied gröner.
QT000005878	Ik snack mit di keen Fransch mehr.
QT000005879	De Snee weer kneedeep.
QT000005880	Dat is hitt vondaag.
QT000005881	Ik keem in ’n Ruum un deed em de Hand schüdden.
QT000005882	De Dokters wullen keen twede Operation maken.
QT000005883	Dröff ik mi dorbisetten?
QT000005884	Disse Jung is von ’e Brügg fullen.
QT000005885	Ik mutt mien Geldbüdel in ’n Supermarkt verloren hebben.
QT000005886	De Deern möök de Ogen dicht un deed ’n Pastoor tohören.
QT000005887	Hest du wüßt, dat Tom dree Kinner hett?
QT000005888	Dat is keen Farken, man en Aap.
QT000005889	Dat is keen lichte Fraag.
QT000005890	De eerste Dag in ’e Week is Maandag.
QT000005891	He kunn nich good mit sien Navers trechkamen.
QT000005892	He slööp glieks to.
QT000005893	Ik will en Auto hebben, man ik heff keen Geld üm een to köpen.
QT000005894	Klein un kregel is better as graat un en Flegel.
QT000005895	Du schußt Tom man seggen, dat Ria dat nich mutt.
QT000005896	Du hest Döst, wullt du Water?
QT000005897	He deed uns sien Hacken wiesen.
QT000005898	Man sien Frünn nöömt em Ken.
QT000005899	Se sünd jüst ankamen.
QT000005900	He keem, as ik al weg weer.
QT000005901	Ik heff disse Week veel Schrievwark daan.
QT000005902	Geev mi dat Book.
QT000005903	He hett dit Book mit twintig Johr schreven.
QT000005904	Se itt nich allens, dor is se krüüsch.
QT000005905	Weet een, wo Tom is?
QT000005906	Mien Naam is Yamada.
QT000005907	Se is jümmer an ’t Rümgrummeln.
QT000005908	De smucksten Deerns kaamt ut Litauen.
QT000005909	Mutt ik dat noch wedder doon?
QT000005910	Se is nich de Soort Deern, de du denkst.
QT000005911	Wees bedankt, dat du bleven büst, bet dat mien Vader na Huus kamen is.
QT000005912	Achter ’n Diek liggt en Diek.
QT000005913	Bickbeern wasst vör allen op Moorbodden good.
QT000005914	Ik bün proppenvull!
QT000005915	Taro is rechts von sien Moder.
QT000005916	Dat is en lütt Geschenk för di.
QT000005917	Jane is lang still bleven.
QT000005918	Ik bün Moslem.
QT000005919	Ik heff dat Graff von mien Vader besöcht.
QT000005920	Se tröck den Stohl to sik ran.
QT000005921	Ik verdeen 100 Euro an ’n Dag.
QT000005922	Woveel Kinner sünd ji?
QT000005923	Ik mieg nich veel.
QT000005924	He is temlich groot.
QT000005925	Twee Tranen sünd över sien Backen rullt.
QT000005926	Güstern weer en Eerdbeven.
QT000005927	Ik heff hoog Fever.
QT000005928	Ik mag di nich.
QT000005929	Se hett em toeerst in Boston drapen.
QT000005930	Dat Ies smeckt good. Wullt du würklich nix hebben?
QT000005931	Ik heff en Leed för di schreven.
QT000005932	Nee, du dröffst nich.
QT000005933	Deit mi leed, dat heff ik nich verstahn. Kannst du dat villicht in een von disse Spraken översetten:
QT000005934	Se möök dat Radio lieser.
QT000005935	Geiht disse Klock?
QT000005936	He seeg ut, as wenn he al Daag nix mehr eten harr.
QT000005937	Wenn ik doodblieven schull, ’keen deed sik denn üm miene Kinner kümmern?
QT000005938	Mien Fööt doot weh.
QT000005939	Wat höllst du von modeerne Kunst?
QT000005940	Villicht hest du dat bloot vergeten.
QT000005941	De Vulkaan is dit Johr twee Maal utbraken.
QT000005942	De Inwahnertall von dit Land warrt minner.
QT000005943	He güng in ’e Kamer op un dal.
QT000005944	Oh, dat Enn hett mi nich gefullen.
QT000005945	Dor is en See oosten von dat Dörp.
QT000005946	He kann Japaansch snacken.
QT000005947	Gau möök se den Breev apen.
QT000005948	Du schusst di de Hoor snieden laten.
QT000005949	He is man knapp ’n Dood utknepen.
QT000005950	Mi dücht, he hett recht.
QT000005951	Ik wull geern üm de Welt seilen.
QT000005952	He hett dree öllere Süstern.
QT000005953	Disse Larm maakt mi noch mallerig.
QT000005954	Se güngen op de Brügg to.
QT000005955	He kummt ut Genf.
QT000005956	Maak dat Finster dicht!
QT000005957	Ik heff en Dutz Eier köfft.
QT000005958	Yōko kann sik keen Reekner köpen.
QT000005959	Dat sünd de blausten Bickbeern, de ik mien Leevdag sehn heff. Jemehr Blau sütt meist künstlich ut.
QT000005960	Denkst du, dat dit Book dat Lesen lohnt?
QT000005961	Berlin is en düütsche Stad.
QT000005962	De Arbeid is meist afslaten.
QT000005963	Ik besöök en Fründ in ’t Krankenhuus.
QT000005964	Ik heff düt Book vör en poor Johren läsen.
QT000005965	Anne hett kene Süster.
QT000005966	Woveel Kinner hest du?
QT000005967	Se hebbt mi behannelt as so ’n Kind.
QT000005968	Dat Brood rückt würklich good.
QT000005969	Op de Idee weer ik nienich kamen.
QT000005970	Dat is al meist halvig twölv.
QT000005971	Dröff ik wat anneres vörslaan?
QT000005972	Dat is mien olen Fründ.
QT000005973	Kaamt se ook?
QT000005974	Disse Stroom is dree Maal so lang as de annere.
QT000005975	Mi dücht, vondaag schall dat hitt warrn.
QT000005976	Wees bedankt för de smucken Blomen.
QT000005977	Herr White is üm un bi mien Öller.
QT000005978	Wohrschienlich will de Baas di na Kalifornien stüren.
QT000005979	Du schusst mehr eten.
QT000005980	He hett mehr Geld as he bruken kann.
QT000005981	Mama! Hector brüüdt mi!
QT000005982	Dat weren ganz normale junge Lüüd.
QT000005983	Mary, disse Ulenspegel, hett ehren Naam an ’n Anfang von dissen Satz backt, üm Tom dit Monopol nich to laten, ofschoonst dat gornich nödig wesen weer.
QT000005984	Guifft dat en anner Woord för Synonym?
QT000005985	Ik heff dree Stück Koken eten.
QT000005986	Dorup kann ick nich mit di tostimmen.
QT000005987	Disse Computer spoort uns en Barg Arbeid.
QT000005988	Mien Vader speelt Golf, man nich good.
QT000005989	De witte Kugel wiggt jüstso veel as de rode.
QT000005990	Wi schöölt di bistahn, egaal wat passeert.
QT000005991	Wannehr is de Ünnerricht vörbi?
QT000005992	’keen hett se funnen?
QT000005993	Wi maakt nu beter wieder.
QT000005994	He mag kene Appelsienen.
QT000005995	Een von jem is en Spijoon.
QT000005996	Dat warrt seggt, dat dat in dit ole Huus spöökt.
QT000005997	Pass op, wat du deist!
QT000005998	Kiek nich in mien Kamer.
QT000005999	Ik bruuk keen Auto.
QT000006000	Föhrst du mit ’n Bus na School?
QT000006001	De Dokter hett mien Brägen ünnersocht.
QT000006002	He is twee Maal in England wesen.
QT000006003	He bevert as Eschenloov.
QT000006004	Tom is nülich up’n Bodden wäsen.
QT000006005	Ik will Koreaansch eten.
QT000006006	Ik laat mi wat infallen.
QT000006007	Buten dat Utlehnen von Böker beedt Bibliotheken verschedene annere Deensten an.
QT000006008	Dat Huus is koold.
QT000006009	De Jung keem dör de Achterdöör rin.
QT000006010	Wannehr schall de Fleger in Guadalajara ankamen?
QT000006011	Se kregen keen Cent.
QT000006012	De Markt is groot.
QT000006013	Ik schriev jeden Dag in mien Dagbook.
QT000006014	Müggen in Minnesota sünd so groot as Störk.
QT000006015	He swemmt jüst.
QT000006016	Boseman is en olen Trapper.
QT000006017	Aver du büst nich dor.
QT000006018	Wi hebbt Klock söss anfungen.
QT000006019	Se mutt dat nich eten.
QT000006020	De Mörder hett sien Verbreken tostahn.
QT000006021	Tom föhrt en olen Ford.
QT000006022	Sluut de Döör.
QT000006023	Ria is stolt up ehr Kinner.
QT000006024	De Fohrrääd in Peking hebbt all Nummernschiller.
QT000006025	De Vulkaan speet Flammen un Lava ut.
QT000006026	Wat hett se vondaag daan?
QT000006027	Wi köönt ehr villicht helpen.
QT000006028	Hier de blanken Fakten.
QT000006029	He lüggt.
QT000006030	Dat hett nix mit di to doon.
QT000006031	Ik heff mien Hanschen in ’e Bibliotheek liggen laten.
QT000006032	De sövente Dag in ’e Week is Sünndag.
QT000006033	Ik krieg in ’n Winter faken en Snööv.
QT000006034	Wannehr sünd ji vonmorgen opstahn?
QT000006035	Wied un sied weer nüms to sehn.
QT000006036	Se weer temlich bruun na ehr Feern.
QT000006037	He is Maandag na New York föhrt.
QT000006038	Wi speelt elk Saterdag Football.
QT000006039	De Tollkeerl deed de Kisten ünnersöken.
QT000006040	Ria hett sik to Wiehnachten en nee Gitarr köfft.
QT000006041	He düker een Stünn later op.
QT000006042	Sapporo is de föfftgröttste Stad von Japan.
QT000006043	„Finnlando“ is en Woord, dat veel Esperantosprekers stöört, denn dat geiht nich na de Regeln uttospreken, oder een mutt akzepteren, dat de Utspraakregeln von ’t Esperanto nich ahn Utnahm sünd.
QT000006044	He is oold noog, üm dat to verstahn.
QT000006045	Hest du al Middag äten?
QT000006046	Ik verstah nich.
QT000006047	Mien Vader is Elektriker.
QT000006048	Se is üm un bi veertig.
QT000006049	Worüm fraagst du nich Herrn White?
QT000006050	He hett nich een Finger röögt.
QT000006051	Se hett dat seggt?
QT000006052	Ik snack elk Dag Engelsch.
QT000006053	Ned höll de Fahn hoog.
QT000006054	Se fröög em, wat he Joseph weer.
QT000006055	Kann ik dien Wöörbook bruken?
QT000006056	In’n Keller reuk det na de Appeln, de dor logern.
QT000006057	Japan bruukt veel Poppeer.
QT000006058	Kennst du den Ünnerscheed twüschen Sülver un Tinn?
QT000006059	Se hett versöcht, ehr sülvs ümtobringen.
QT000006060	Ik deed em nich geern an en düüstern Oord drepen.
QT000006061	Du süst ut, as wenn du to doon hest.
QT000006062	Ik seed „Stopp!“
QT000006063	Dor sitt en Bayer mit en Ledderbüx.
QT000006064	Dat weer al de hele Week an ’t Sneen.
QT000006065	Hett Tom al en Inladen kregen?
QT000006066	Se is vör twee Johr von de School afgahn.
QT000006067	Vun Sofia na Warna sünd dat mit dat Auto söß Stunnen.
QT000006068	Fievdusend Dollar sünd en Hümpel Geld.
QT000006069	Mi dücht, Computerviren schullen as Levensform ankeken warrn.
QT000006070	Du musst nich grölen. Ik kann di ook so hören.
QT000006071	Wi wullen geern en Sofa köpen.
QT000006072	Dat weer de gröttste Fehler von mien Leven.
QT000006073	Ji bünt bannig dapper.
QT000006074	He keen ut de Ruut.
QT000006075	Düütsch warrt nich blot in Düütschland snackt.
QT000006076	Wo blifft denn dor de Logik?
QT000006077	Se hett en goot Arbeit för em funnen.
QT000006078	De Maand is achter de Wulken.
QT000006079	Mozart sien Leven weer temlich kort.
QT000006080	Dat is de Kamer, in de de Schrieversche sik ümbrocht hett.
QT000006081	In ’n Winter warrt dat gau düüster.
QT000006082	Dat is gornich to ’n Lachen.
QT000006083	Buten mi weer nüms hier.
QT000006084	He hett nich mehr as 1.000 Yen.
QT000006085	Ik seuk mien Süstern.
QT000006086	De Deern driggt en Schaal üm ’n Hals.
QT000006087	Se verköfft Blomen.
QT000006088	Elk Saterdag speelt wi Football.
QT000006089	Dat is gresig koold.
QT000006090	Tomás is mien Broder.
QT000006091	In ’t Huus spöökt dat.
QT000006092	Du musst doon, wat ik segg.
QT000006093	He is dör den Romaan beröhmt worrn.
QT000006094	Wi kunnen nich rutkriegen, wat se wull.
QT000006095	Du kannst nu na Huus gahn.
QT000006096	Laat di de Hoor snieden.
QT000006097	De Maschen warrt dör Dieken schuult.
QT000006098	Dat is Apenfleesch.
QT000006099	‚Tammi‘ mit twee m. Also T-A-M-M-I.
QT000006100	’Keen speelt opbest Örgel?
QT000006101	De Gorilla weer to de Tied een Johr oold.
QT000006102	Ik treck tokamen Maand ut.
QT000006103	Güstern weer mien Geboortsdag.
QT000006104	Op jeden Pott passt en Stulp.
QT000006105	Wat för ’n Nettkieker bruukst du?
QT000006106	He is temlich jung doodbleven, he weer man 59 Johr oold.
QT000006107	Is noch Melk dor?
QT000006108	Maak dat Finster dicht, dat tütt!
QT000006109	Vertroost du ehr?
QT000006110	Bald is Neejohr.
QT000006111	De Toilett weer achter de Trepp.
QT000006112	Wat hebbt ji mit miene Büx maakt?
QT000006113	Ik heff en Hund.
QT000006114	He kann ehr Fragen nich antern.
QT000006115	Ik mag de Oord lieden, wo du smüüsterst.
QT000006116	Wi wüllt blot helpen.
QT000006117	Wat schall ik denn morgen doon?
QT000006118	Ik bün em güstern tofällig op ’n Flegerhaven in ’e Mööt kamen.
QT000006119	Wat hest du Mike to ’n Geboortsdag schunken?
QT000006120	Uns Lehrer kummt jümmer rechttiedig na ’n Ünnerricht.
QT000006121	Dien Naam steiht bavenan op de List.
QT000006122	Is dat schier Gold?
QT000006123	Lees dissen Satz nich.
QT000006124	Ik heff tonahmen.
QT000006125	De Aptiet kummt bi ’t Eten.
QT000006126	Tom wœr nich trurig.
QT000006127	De Beer rückt good.
QT000006128	Raad ees, ’keen mi güstern besöcht hett.
QT000006129	Laat di nich mit disse Postüren in.
QT000006130	Denk dor över na.
QT000006131	Wi hebbt dat schafft!
QT000006132	De Eer is keen Steern, man en Planeet.
QT000006133	Mary is sööt. Jane ook.
QT000006134	Ik heff mit Smöken un Drinken ophöört.
QT000006135	Jo. Nee. Villicht. Ik weet nich.
QT000006136	Ik will, dat du Tom seggst, dat du em nich mehr leef hest.
QT000006137	Ik heff keen Koppwehdaag mehr.
QT000006138	He lööp in ’e Klass.
QT000006139	In wat för en Öller harrst du dien eerste Fründin?
QT000006140	He is bi dat ane Radio toslapen.
QT000006141	Ik heff keen Tied mehr.
QT000006142	Du musst tomaken.
QT000006143	He hett vörig Johr Kyoto besöcht.
QT000006144	Ik heff aver keen Geld.
QT000006145	Ik lehn di een, wenn du wullt.
QT000006146	Ik harr geern dree von disse.
QT000006147	Do see de Herr to Kain: „Woneem is dien Broder Abel?“ He see:„Dat weet ik nich. Schull ik wull ok noch up em passen?“
QT000006148	Ik kenn ehr Adress.
QT000006149	Is dat Beer in ’n Mann, is de Verstand in de Kann.
QT000006150	Dat Speel weer traag un langwielig.
QT000006151	Katten köönt in ’n Düüstern sehn.
